title|link|date|elle_link|contents|category|title_name|check
금요일마다 체포되는 여자|http://v.media.daum.net/v/20200413124856861|2020.04.13|http://v.media.daum.net/v/20200413124856861?f=o|[['', '', '', '제인 폰더는 목소리보다 이미지가 더 멀리, 더 빨리 전파된다는 것을 안다. 지난해 11월, 워싱턴 D.C.에서 샘 워터스톤, 테드 댄슨과 함께 기후 변화에 무신경한 미국을 규탄하는 시위 ‘파이어 드릴 프라이데이’를 시작한 이래 폰더는 금요일마다 시위에 동참 중이다. 소셜 미디어에 정통한 이 82세의 여인은 카메라 시선을 확실히 잡아 끄는 선명한 빨간색의 트렌치코트와 베레 차림으로 시위에 나선다. 그리고 매주마다 플라스틱 수갑(아이러니하게도 일회용)을 차고 끌려 나간다. 제인 폰더는 체포되는 모습도 멋져 보인다. 폰더가 처음 체포된 건 1970년 클리블랜드에서다. 알려진 바에 따르면 폰더는 캐나다에서 투어 강연을 마치고 돌아오던 중 비타민을 플라스틱 통에 넣어 휴대했는데, 그것을 마약으로 오인해 리처드 닉슨의 명령에 따라 체포됐다. 폰더는 이중 관절의 소유자다. 지난 9월 초 토론토에서 그녀는 메스칼주를 마시며 이 사실을 털어놓았다. 본인의 이중 관절 덕분에 당시 머그 샷(Mug Shot)을 찍을 때 수갑에서 손을 빼내 주먹 쥔 손으로 단결 인사를 할 수 있었다는 것이다. 물론 제인 폰더는 곧 풀려났고, 그녀의 인생 첫 ‘체포 사진’은 전설이 됐다. 사진에서 폰더는 삐죽빼죽한 뮬렛 스타일의 머리를 하고, 왼쪽 주먹을 불끈 쥐고 있다. 제인 폰더가 첫 번째 오스카상을 수상한 영화 〈콜걸〉에 등장한 모습 그대로다. 그녀의 머그 샷은 이후 여성 저항운동의 상징이 됐다. 그녀가 털어놓은 또 다른 비밀은 워싱턴 D.C.에서 시위 선두에 서기 위해 넷플릭스 인기 시리즈 〈그레이스 앤드 프랭키〉 제작진에게 4개월 휴가를 요청했다는 사실이다. 폰더는 그레타 툰베리와 자신의 ‘구루’인 캐나다 작가이자 사회활동가 나오미 클레인(이달 〈엘르〉의 지구의 날 스페셜에 그녀의 인터뷰 기사가 있다)에게 고무돼 ‘편안한 삶 깨뜨리기’에 열중하고 있는 느낌이라며 자신의 근황을 설명했다.', '', '', '', '', '', '', '', '', '', '', '넷플릭스 오리지널 시리즈 〈그레이스 앤드 프랭키〉에서 제인 폰더는 여자들 우정의 중요성을 보여주며 그녀의 진짜 삶을 비춘다. 프로그램에 함께 출연하는 배우 릴리 톰린은 스크린 밖에서도 폰더의 절친이다. “나를 진정으로 위하는 사람들, 내가 진정으로 위하는 사람들은 바로 여자 친구들이에요. 나는 50년대를 관통하며 성장기를 보냈는데, 성장기의 정점에 엄마가 자살로 세상을 떠났어요. 그래서 나는 전적으로 엄격한 개인주의자인 남자들에게 동질감을 느꼈던 것 같아요.” 폰더는 엄마의 자살 이야기를 잠시 이어갔다. 그녀의 이야기를 지면에 모두 옮기기는 어렵지만, 이미 제인 폰더는 저서를 통해 그것이 본인에게 얼마나 깊은 상실이었는지 이야기했다. 그 일은 폰더가 12세일 때 일어났고, 그녀를 남성 롤 모델에 의지하게 만들었다. 제인 폰더는 수십 년이 지난 후에 엄마의 인생을 조사하고 그녀의 병원 기록을 살펴본 후에야 비극과 화해할 수 있었다고 했다. 폰더는 성인이 된 이후에야 부모와 조부모가 그들의 인생과 이야기를 지닌 개별적 존재임을 이해하게 됐고, 한 걸음 도약해 엄마의 자살이 그녀의 잘못이 아님을 받아들였다고 한다. 이 고통스러운 여정 때문에 폰더가 젊은이들에게 그토록 각광받는 것이리라. 폰더는 툰베리 같은 젊은이에게서 영감을 얻는 동시에 그들을 걱정한다. “젊다는 것은 항상 어려운 일이잖아요. 나이 든 사람은 적어도 걱정해야 할 것이 무엇인지 알아요. 이미 위기를 겪었고 살아남았으니까요.” 연기는 공감의 기술이다. 우리는 이제 폰더가 여러 활동을 통해 이 세대가 직면한 것들 속으로 들어가려는 것을 볼 수 있다. 그녀는 말한다. “젊을 때 사람들은 생각하죠. 나는 앞으로 어떤 사람을 알게 될까? 무엇을 하게 될까? 그런데 지금은 불확실성이 너무 큰 시대예요. 내가 젊을 때보다 100배는 더 상황이 악화됐죠.” 그녀는 눈썹을 올리고 고개를 끄덕이며 덧붙인다. “그러나 사실 내게는 옛날도 전혀 좋은 시절은 아니었어요. 그래도 나는 백인이기에 누릴 수 있었던 특권이 있었어요. 유색인, 동성애자, 장애인에게는 모든 것이 더 어려웠겠죠.” 폰더는 여러 차례 자신이 특권을 누렸다는 사실을 인정하는 발언을 해왔다. 지혜를 향한 그녀의 여정은 자신의 인생을 여러 차례 반추하게 했을 뿐 아니라 수많은 치유의 순간도 경험하게 했다.', '', ''], ['', '우리가 인터뷰를 위해 자리에 앉은 건 오후 7시 무렵이었다. 거의 12시간을 연설과 인터뷰로 보낸 폰더는 마침내 샹그릴라 호텔의 프라이빗한 식당에 자리를 잡았다. 그녀의 앉은 자세는 무척 꼿꼿하다. 모두가 구부정한 자세로 살아가는 이 시대에 제인 폰더의 도도한 자세는 자못 비범하기까지 하다. 그녀는 신중하게 생각하고 아름답게 다듬은 문장을 구사하며, 톡톡 튀는 지성을 카리스마 있게 전달하는 능력을 가졌다. 제인 폰더는 토론토에서 로레알 파리 에이지 퍼펙트의 자랑스러운 모델로 활동 중이다. 폰더는 자신의 개인 홈페이지에 “그들은 내 나이 때문에 나를 선택했다. ‘이런 나이에도 불구하고’가 아니라”라고 썼다. “로레알 파리의 생각은 확고해요. 아름다움은 단지 젊음이나 모델의 완벽함에 있지 않고 인종과 나이를 뛰어넘어 모든 인간에게 있다고 믿죠.” 폰더는 덧붙였다.', '제인 폰더의 정체성에는 그녀가 맺어온 관계의 변화가 영향을 미쳤다. 전설적 배우 헨리 폰더의 딸로 태어난 그녀는 1959년에 어빙 펜이 촬영한 사진으로 〈보그〉 커버 모델이 되면서 대중의 눈에 띄기 시작했다. 그 후 얼마간의 뉴욕 무대 활동, 궁극의 메소드 연기 코치 리 스트라스버그의 트레이닝을 거쳐 60년대 프랑스영화의 섹스 심벌로 떠올랐는데, 그 시절 그녀는 1968년 작 SF 고전영화인 〈바바렐라〉를 연출한 로제 바딤과 결혼했다. 폰더는 당시 학생운동으로 소용돌이 치던 프랑스에 살며 사회적 정의를 대변하는 역할을 맡았다. 이는 그녀로 하여금 베트남전쟁에 대한 미국의 개입을 강하게 비난하는 반전 운동가로서 정체성을 갖도록 이끌기도 했다. 이때부터 폰더는 전형을 탈피한 심각하고 무거운 인물을 연기했다. 스크린 속 자신의 이미지를 바꾸기 시작한 것이다. 제인 폰더는 일곱 번에 걸쳐 오스카에 노미네이트됐는데, 그녀에게 두 번째 오스카상을 안겨준 1978년 작 〈귀향〉과 1979년 작 〈차이나 신드롬〉에서 보여준 변화가 대표적이다. 이 시절 그녀는 캘리포니아의 활동가 톰 헤이든과 재혼해 진보적 민주당원으로 변신했다. 제인 폰더는 항상 대중문화의 흐름보다 한 걸음 혹은 두 걸음 앞섰다. 1980년 작 〈나인 투 파이브〉를 통해 직장에서의 불공정한 여성 지위에 꽤 일찍이 스포트라이트를 비췄고, 한 시대를 풍미한 책과 비디오 시리즈 〈제인 폰더의 워크아웃〉을 출시하며 사업에 손대기도 했다. 당시 폰더는 남편인 톰 헤이든과 추진 중이던 사회 정의 프로젝트의 기금 마련을 위해 이 사업을 기획했지만, 예상치 못한 덤으로 전 세계에 레그 워머를 유행시키는 결과를 초래하게 됐다. 다음 단계의 제인 폰더는 CNN 설립자인 테드 터너 여사였다. 영화산업에서 잠시 은퇴한 상태였던 그녀는 여성 미디어 센터의 기반 작업을 조용히 수행하고 부부의 근거지인 조지아 주의 청소년 임신을 막는 일을 하면서 90년대와 2000년대 첫 10년의 초반을 훌륭하게 은둔하며 보냈다. 2001년, 그녀가 줄곧 “내가 가장 좋아하는 전남편”이라 부르는 테드 터너를 떠나기로 결심했을 때 그녀는 페미니즘과 기독교를 받아들이며 자신의 회고록 집필을 시작했다. 한없이 깊은 물속으로 침잠하여 자신을 돌이켜보는 시간을 지낸 뒤, 폰더는 2005년의 히트작 〈퍼펙트 웨딩〉으로 화려하게 돌아왔다. 제인 폰더의 믿기지 않을 정도로 빛나는 경력 중 〈퍼펙트 웨딩〉이 바람처럼 거둔 성공은 시위를 향한 그녀의 투지를 호도하는 결과를 낳았다. 지금도 여전히 시위의 선두에 나서려는 폰더, 즉 진짜 폰더는 우리가 알고 있는 화려한 이미지의 제인 폰더와 상충한다. 어쩌면 제인 폰더의 성공은 그녀가 자신의 정체성과 이미지의 상충을 심각하게 여기지 않는다는 사실에 기인할지도 모른다. “저는 완전한 모습 같은 건 너무 불편해서 싫어요.”', '하지만 제인 폰더는 무엇이든 자신이 하려고만 하면 바르게 해낸다. 또 그녀는 이 체제가 어떻게 작동하는지를 잘 알고 있다. 인기 TV 드라마에 출연하면 대중과 새로운 관계를 만들 수 있으며, 명성은 그녀에게 활동 근거를 제공하지만 그녀를 낱낱이 까발려 놓기도 한다는 것을 말이다. 폰더는 통제력을 충분히 단련하지 못한 채 데뷔했던 어린 시절부터 40대까지, 폭식증과 싸우며 보낸 나날에 대해서도 이야기했다. 그녀는 인생에서 외모의 역할을 규정하는 목소리 때문에 항상 힘들었다고 했다. 요즘 제인 폰더는 자신의 사회운동의 파급력을 높이기 위해 소셜 미디어를 적극적으로 이용하는 중이다. 그녀가 소셜 미디어에 정통한 사람이 되기 위해 취한 방법은 정직함을 원칙으로 삼는 것. “나는 소셜 미디어에서 진정으로 정직한 모습을 보이기 위해 아주 긴 투쟁을 벌였어요. 그리고 이제는 초췌하게 보이는 사진들도 그냥 올리죠. 한번은 이가 빠진 모습도 올렸어요! 포르투갈의 한 레스토랑에서 갑자기 이가 빠져버렸거든요.” 제인 폰더가 자신의 진실을 밝힌 회고록 〈My Life So Far〉(2005)와 나이 듦에 관한 저서 〈Prime Time〉(2011) 그리고 HBO 다큐멘터리로 제작된 〈제인 폰더 인 파이브 액츠〉(2018)를 통해 그녀는 자신이 다른 누구와 연결될 수 있는 가장 근본적인 방법을 찾았다. “나는 그때 진실은 보편적이라는 걸 알았어요. 충분히 착하지 않고, 아빠를 비롯해 다른 사람들을 기쁘게 해야 하고, 충분히 예쁘거나 날씬하지 않으며, 충분히 똑똑하지도 않다는 사실이 모든 여성에게는 보편적인 진실이고요.” 성공적인 경력에도 불구하고 제인 폰더는 자신에게 정체성을 부여하기 위해 남자들과 결혼해 왔다고 한다. 뉴웨이브 영화 스타였던 바딤, 사회 정의의 전사였던 헤이든 그리고 최고의 부유층 거물인 터너와 말이다. 관계는 매번 끝났다. “나는 ‘그와 함께하지 않으면 아무도 나에게 말을 걸지 않을 것이고, 나는 끝장날 거야’라고 생각했어요”라고 그녀는 말한다. 주변 사람을 기쁘게 하려는 병이 그녀를 공허하게 만든 것이다. 지금 제인 폰더는 독신이다. 이것은 매우 의식적인 선택이었다. 그녀는 인생의 이번 챕터를 자신에게 바치기로 했다. 인터뷰 중에 제인 폰더는 반복해서 말했다. “난 이제 결혼과 담을 쌓았답니다.”', '', '', '폰더는 우리에게 앞을 보기 전에 뒤를 돌아봐야 한다고 조언한다. “당신의 눈에 띄는 문제를 발견했다면 그것은 당신이 해결해야 할 문제입니다. 모든 사람에게는 스스로 어쩔 수 없는 정신적 상처가 있어요. 우리는 살면서 그것들을 관리하는 법을 배워요. 그것들을 구석으로 추방하고 꼬리표를 달아 나오지 못하도록 금지하는 법을 배우죠.” 폰더는 “내가 어릴 때, 사람들은 여자를 ‘서로를 쓰러뜨리려 경쟁하는 고양이’로 생각했어요. 하지만 여성이 뭉치면 못 이룰 것이 없죠”라고 말하며 눈을 반짝였다. “이 시대가 요구하는 것은 단체 행동이에요. 그리고 여성은 단체 행동을 잘합니다. 진화론적인 이유로 여성은 개인주의에 영향을 덜 받아요. 어떤 면에서는 이것이 여성의 장점이고 힘이죠. 어떤 훌륭한 일도 대중운동 없이는 일어나지 않아요. 세계가 기후 문제에 집중하기 위해 지금 필요한 것은 바로 대중운동이에요.” 함께 걸으면 더 멀리 갈 수 있다는 걸 제인 폰더는 알고 있다.']]|STAR|0|0
스타 패션 in 패션위크|http://v.media.daum.net/v/20200403000039850|2020.04.03|http://v.media.daum.net/v/20200403000039850?f=o|[['', '', '', '남편 마이클 폴리시 감독과 함께 ‘럽스타그램’의 모범을 보여주고 있는 케이트 보스워스. 사랑에 빠진 여자는 아름답다더니, 끌로에의 수트를 이토록 우아하게 소화해 냈다. 가방과 색을 맞춘 차분한 립 컬러도 신의 한 수.', '', '', '', '', '', '때로는 밝은 미소도 스타일링이 될 수 있다. 오프화이트™ 쇼에서 포착된 카를라 브루니는 화사한 그린 컬러 드레스와 발그레한 두 뺨, 미소가 어우러져 보는 이의 기분까지 산뜻하게 만든다.', '', '', '', '', '', '이제는 모델보다 배우란 수식어가 자연스러워진 카라 델레바인. 디올 패션쇼에 참석하기 위해 숨겨왔던 여성미를 뽐냈다. 자수로 장식한 시스루 미니드레스 아래로 쭉 뻗은 각선미가 ‘역시!’라는 감탄을 자아낸다.', '', '', '', '', '', '패션계의 러브콜이 빗발치는 화제의 중심! 블랙핑크 로제가 파리에 나타났다. 생 로랑의 클래식한 벨벳 재킷과 마이크로 미니 쇼츠를 매치해 젊은 감각의 ‘프렌치 시크’를 보여줬다.', '', '', '', '', '', '자유분방함과 우아함이 공존하는 레아 세이두는 스타일링에서도 상반된 아이템의 믹스매치로 자신만의 개성을 표현한다. 클래식한 트위드 재킷과 스커트에 현대적 감각의 부츠를 더하는 식.', '', '', '', '', '', '이 미모가 50대라니 ‘실화’인가? 버버리 쇼에서 올 블랙 룩의 정석을 보여준 케이트 블란쳇. ‘똑’ 떨어지는 케이프 코트와 테일러드 팬츠에, 골드 컬러의 체인 벨트 하나로 포인트를 준 노련함이 돋보인다.', '', '', '', '', '', '코치 2020 F/W 쇼에 참석하기 위해 뉴욕 나들이에 나선 설현. 옐로와 블루 컬러의 극명한 대비 속에서도 빛을 발하는 미모가 인상적.', '', '', '', '', '', '스타일 아이콘 카일리 제너는 톰 포드의 여전사로 변신했다. 메탈 플레이트를 촘촘하게 연결한 ‘갑옷’ 드레스를 입고, 높이 올려 묶은 포니테일 헤어스타일을 연출한 것.', '', '', '', '', '', '하이더 아크만 쇼에 참석한 티모시 샬라메는 티셔츠와 청바지로 평범한 스타일링을 한 듯 보이지만, 레이어드한 목걸이와 팔찌, 포켓 디테일의 팬츠와 하이톱 스니커즈까지 아이템 하나하나에 재미를 더했다. 캐주얼과 ‘힙’ 사이를 넘나드는 미묘한 감각에서 스타일링 고수의 기운이 느껴진다.', '', '', '', '', '', '자넬 모네의 대담함은 음악에만 국한되지 않는다. 샤넬 패션쇼에 참석한 그녀는 재킷의 단추를 모두 풀어 속살을 아슬아슬하게 드러냈다. 오직 그녀만이 할 수 있는 비범한 스타일!', '', ''], ['', '', '', '', '', '', '', '', '', '']]|FASHION|0|0
딱 한 잔만_맛의 동선 #6|http://v.media.daum.net/v/20200312152649143|2020.03.12|http://v.media.daum.net/v/20200312152649143?f=o|[['', '', '', '참 바', '', '', '', '', '', '라 꾸쁘', '', '', '', '', '', '페페로니', '', '', '', '', '', '기사', '', '', '', '', '', '6-3', '', '', '', '', '', '멜랑즈', '', '', '', '', '', '*오랜 사람들과 맛있는 걸 먹을 때 가장 행복한 여자, 안동선의 바로 지금 먹어야 하는 맛 이야기는 매주 목요일에 업데이트됩니다.', '', ''], ['', '서촌에서 가장 유명한 위스키 & 칵테일 바. 한옥 서까래를 그대로 살린 인테리어, 천창 너머로 보이는 밤하늘이 고즈넉하고 로맨틱한 분위기를 자아낸다. 수성동 계곡 근처에 있는 집으로 가는 길목, 참 바에서 새어 나오는 오렌지빛을 거부하기란 쉽지 않다. 인기인 곳답게 두툼한 문을 열고 들어가면 고요한 골목길과 대비되는 화기애애한 술판이 연인 벌어지고 있다. 청신한 진토닉 한잔에 모든 답답함이 깔끔하게 해소되고 새털 같은 마음으로 귀가하게 해주는 곳. 종로구 자하문로7길 34 인스타그램 @bar.cham', '', '매거진 주류 담당 에디터, 주류 수입사 직원 등 술 전문가인 세 여자가 의기투합해 문 연 라 꾸쁘는 지난 1년간 강북에서 가장 핫한 와인바로 명성이 드높았다. 맛깔난 스몰 플레이트 안주들과 와인부터 리큐어까지 메뉴를 고루 갖추었다. 헛헛한 마음이 들 때 고수 팍 들어간 라면에 만만한 로제 와인 한잔하고 나면 코어에 힘이 차오른다. 종로구 계동길 15 인스타그램 @coupeseoul', '', '합정역 상가에 자리해 수년 동안 확실한 단골을 만든 이 집의 내공은 요리하는 아내, 와인 골라주는 남편의 찰떡같은 합이다. 다양한 와인을 잔으로 마실 수 있는 것도 좋고 올리브, 치즈처럼 간소한 것부터 등갈비, 파스타까지 메뉴 구성도 다양하다. 오픈 키친에서 전해오는 맛있는 냄새에 어느덧 파스타를 시켜서 본격 식사를 하게 된다는 함정! 마포구 월드컵로3길 14 인스타그램 @peperoni0304', '', '삼청동 막다른 골목에 자리한 기사는 주인장의 독특한 아이덴티티가 그대로 배어나는 공간이다. 부암동 심야오뎅을 운영했던 주인장은 아담한 디귿자 바를 둘러싼 손님들을 응대하면서 주방에서 갖가지 안주를 만든다. 감태와 명란 구이, 오뎅탕 등 모든 메뉴에서 놀라운 손맛을 발견하게 된다. 생맥주부터 뜨끈하게 데운 사케, 하이볼까지 주류 메뉴 또한 아쉬움이 없다. 종로구 삼청동 68 www.royalsketch.org', '', '화장실에도 에르메스 벽지가 발라져 있는 근사한 인테리어, 높은 천고의 통창 너머로 보이는 공간이 선사하는 격조가 있다. 창작 요리를 선보이는데 늦은 밤 정성껏 만든 디저트를 먹는 일이 쉽지 않은 만큼 6-3에선 디저트를 시킨다. 그러면 센스 좋은 서버가 허니 뉘앙스의 스파클링 와인을 추천해준다. 달콤한 밤을 위한 곳. 강남구 삼성로149길 8 인스타그램 @6-3seoul', '', '청담동에서 가성비 좋은 내추럴 와인바를 추천하라면 단연 멜랑즈. 곱창으로 1차 하고 나서 혹은 심야 영화 보고 나서 잘 만든 파스타에 화이트 와인 한잔하고 싶을 때 간다. 직접 만든 소시지, 리소토 위에 얹은 삼치구이, 뜨끈한 양파 수프…. 캐주얼한 분위기지만 뭐 하나 빠지는 게 없는 서양 식당. 강남구 논현동 96-11 2층인스타그램 @melange_wine_bar', '']]|LOVE&LIFE|0|0
같은 옷 다른 느낌! 패션위크를 찾은 K스타 VS 런웨이 모델|http://v.media.daum.net/v/20200303121154329|2020.03.03|http://v.media.daum.net/v/20200303121154329?f=o|"[['「 송혜교, 보테가 베네타 」', '「 송혜교, 보테가 베네타 」', '', '', '지금 가장 핫한 브랜드 보테가 베네타의 쇼 장을 찾은 배우 송혜교. S/S 컬렉션 룩을 선택했는데요. 재킷을 미니 드레스처럼 연출한 센스가 돋보이죠? 백과 슈즈, 타이츠까지 모두 블랙으로 우아하게 통일하고, 룩 분위기를 헤어와 메이크업까지 고혹적으로 스타일링 했어요.', '', '', '「 리사, 프라다 」', '「 리사, 프라다 」', '', '', '프라다 쇼 장을 콘서트 현장으로 만든 장본인이죠. 어마무시한 글로벌 팬덤의 주인공 블랙핑크 리사! 골드 톤의 스커트 투피스를 매치해 완벽한 프라다 걸로 변신했습니다. 런웨이 룩과 다른 점은 바로 백. 룩의 컬러와 맞춰 골드 백을 선택했네요.', '', '', '「 한예슬, 펜디 」', '「 한예슬, 펜디 」', '', '', '2020 S/S 컬렉션의 피날레였던 롱 드레스 차림으로 펜디 쇼 장을 찾은 한예슬. 화려하고 컬러풀한 플로럴 패턴이 한예슬과도 잘 어울리죠?', '', '', '「 아이유, 구찌 」', '「 아이유, 구찌 」', '', '', '화사하고 사랑스러운 베이비 핑크 컬러의 투피스를 선택한 아이유. 한국을 대표해 구찌 2020 F/W 패션쇼장을 찾았습니다. S/S 런웨이 룩과는 다른 분위기의 액세서리를 선택한 부분이 눈에 띄죠? 블링블링한 나비 모양의 주얼 초커와 진주 이어링, 딥 레드 컬러의 숄더 백과 블랙 슈즈로 아이유만의 러블리한 분위기를 살렸네요.', '', '', '「 로제, 생 로랑 」', '「 로제, 생 로랑 」', '', '', ""지난 시즌에 이어 두 번째로 생로랑 쇼를 찾은 블랙핑크 로제. 런웨이 룩을 그대로 '복붙'하고 블랙 크로스 백을 매치했네요. 로제의 싱그러운 매력 덕분에 런웨이 모델과는 완전히 다른 분위기죠?"", '', '', '「 박민영, 토즈 」', '「 박민영, 토즈 」', '', '', '토즈의 새로운 앰버서더로 발탁된 배우 박민영. 새로운 크리에이티브 디렉터인 발테르키아포니가 선보이는 F/W 패션 쇼에 참석했습니다. 레더 소재가 믹스된 블랙 드레스로 우아한 매력을 뽐냈는데요. 런웨이 모델이 골드 로퍼로 좀 더 캐주얼하게 연출했다면, 블랙 초커와 키링, 파우더리한 퍼플 컬러의 힐을 매치해 눈길을 끌었습니다.', '', '', '「 조이, 마이클 코어스 」', '「 조이, 마이클 코어스 」', '', '', '레드벨벳의 조이는 마이클 코어스 컬렉션에 참석하기 위해 뉴욕으로 향했습니다. 어깨에 달린 러플과 트리밍 포인트가 돋보이는 니트와 체크 스커트로 발랄한 분위기의 프레피 룩을 완성했네요. 모델과는 달리 블랙 워커와 투웨이로 활용할 수 있는 화이트 백을 매치했습니다.', '', '', '「 설현, 코치 」', '「 설현, 코치 」', '', '', '네이비 레더 봄버와 버튼 디테일의 스커트와 노란 블라우스를 선택한 설현. 런웨이 모델과 다른 점을 꼽자면? 액세서리를 블랙으로 시크하게 통일한 것! 근사한 모습으로 한국을 대표에 코치 F/W 패션쇼 장의 프런트로 빛냈어요.', '', ''], ['', '', '', '', '', '', '', '']]"|FASHION|0|0
프런트로를 접수한 스타 5|http://v.media.daum.net/v/20200303080045670|2020.03.03|http://v.media.daum.net/v/20200303080045670?f=o|[['「 블랙핑크 로제 」', '「 블랙핑크 로제 」', '', '', '블랙핑크 로제는 생로랑 컬렉션에 참석한 후 자신의 SNS에 “안토니바카렐로, 놀라운 쇼였어요. 나는 당신을 매우 존경합니다. 축하해요, 내 사랑.” 감탄과 사랑을 담아 메시지를 남겼습니다.', '', '', '「 한예슬 」', '「 한예슬 」', '', '', '', '', '', '화려한 플로럴 드레스로 쟁쟁한 프런트로 스타들 사이에서도 시선을 사로잡은 한예슬. 밀라노를 대표하는 브랜드 펜디 컬렉션에 참석하며 여러 장의 사진을 인스타그램에 업로드했어요. 브랜드를 이끄는 수장 실비아 벤투리니 펜디와 함께 인증샷을 찍는 것도 잊지 않았죠.', '「 송혜교 」', '「 송혜교 」', '', '', '', '보테가 베네타의 쇼장을 찾아 월드클래스 포스를 드러낸 송혜교의 룩을 감상해볼까요? 독특한 테일러 링과 깊게 파인 네크라인이 우아함을 강조하고 있어요. 체인 장식 클러치 백으로 에지를 더한 송혜교는 완벽 그 자체!', '「 설현 」', '「 설현 」', '', '', '', '블루 레더 투피스를 입고 허튼 백을 든 설현은 뉴욕 컬렉션 코치 쇼를 찾았습니다. 다채로운 원색과 핸드메이드 디테일을 믹스한 코치의 새로운 컬렉션에 설현도 푹 빠진 듯하네요.', '「 박민영 」', '「 박민영 」', '', '', '', '토즈 컬렉션 장을 찾은 박민영은 인간 토즈로 변신했습니다. 관능적인 드레스 위에 모던한 레더 코트를 걸쳐 고혹적인 드레스 룩을 완성했네요.'], ['', '', '', '', '', '', '', '', '', '']]|STAR|0|0
