title|link|date|elle_link|contents|category|title_name|check|member|magazine|word_jenny
헤어핀 데칼코마니|http://v.media.daum.net/v/20191223000106533|2019.12.23|http://v.media.daum.net/v/20191223000106533?f=o|[['', '', '', '페이스 라인을 살짝 가린 긴 생머리에 앙증맞은 퍼 장식의 헤어핀을 꽂고 90년대를 재현한 아리아나 그란데. 진한 스모키 메이크업이 ‘센 언니’처럼 보이지 않게 두 개의 헤어핀으로 귀여움을 추가했어요.', '', '', '', '', '', '제니의 헤어 스타일은 교복을 입은 소녀의 풋풋함을 떠올리게 합니다. 기교 없이 곱게 빗어 정리한 생머리를 5:5로 나누고 양쪽에 얌전하게 검은 실핀을 꽂았어요. 조신한 트위드 스커트 수트에 젊은 에너지를 채우는 사소한 스타일 팁을 기억하세요.', '', '', '', '', '', '소피아 리치는 블론드 헤어를 가지런히 정리해 가운데 가르마를 나눈 뒤 긴 헤어핀을 가르마와 나란하게 꽂았어요. 구릿빛 피부와 완벽한 메이크업, 한 치의 오차도 없이 정리한 헤어 스타일 덕에 그녀는 오늘 바비 인형으로 변신한 듯 완벽하네요.', '', '', '', '', '', '아이린의 남다른 헤어핀 스타일링 살펴볼까요? 가르마를 정확하게 나누고 잔머리 없이 깨끗하게 빗어 내린 후 금색 실핀을 양쪽에 꽂았어요. 직선과 X로 교차시킨 실핀이 반복되니 한층 발랄해 보이네요. 귀여움을 포기할 수 없다면 그녀처럼 실핀을 이용하세요.', '', '', '', '', '', '깜찍한 5:5 헤어핀 꽂기 스킬은 섹시한 룩에도 활용됩니다. 싱어송라이터 비비 렉사의 사진을 보세요. 네트 소재의 점프 수트를 입고 실버스톤 장식의 헤어핀을 추가했어요. 팝스타의 당당함을 드러내는 관능미를 한껏 부각한 룩에 귀여운 헤어핀이 의외로 잘 어울리죠? 당신의 유니크한 감성에 박수를 보내요~.', '', ''], ['', '', '', '', '']]|BEAUTY|0|0|Je|E|['제니의 헤어 스타일은 교복을 입은 소녀의 풋풋함을 떠올리게 합니다. 기교 없이 곱게 빗어 정리한 생머리를 5:5로 나누고 양쪽에 얌전하게 검은 실핀을 꽂았어요. 조신한 트위드 스커트 수트에 젊은 에너지를 채우는 사소한 스타일 팁을 기억하세요.']
패션 사진가의 밤, 제니도 출동했다!|http://v.media.daum.net/v/20191215223437529|2019.12.15|http://v.media.daum.net/v/20191215223437529?f=o|"[['', '', '', '선 후배 누구 할 것 없이 에디터, 모델, 스타일리스트, 헤어 & 메이크업 아티스트, 세트스타일리스트 등 함께 일해온 모두를 초대해 축하와 격려의 자리를 갖는 것이죠. 올 한해, 멋진 사진과 영상을 만드느라 수고했다는 의미!', '', '', '', '', '', '', '', '', '', '', '', '', '', '', '', '', '', '', '', '', '', '', '', '', '', '', '', '', '', '', '', '', '', '', '', '', '', '', '', ''], ['매달 새롭게 발간되는 <엘르>를 비롯한 수많은 잡지들과 새 계절의 시작을 알리는 광고 캠페인, 길을 가다 마주치는 스타들의 멋진 사진 한장을 위해 카메라를 드는 사람들.', '상업 사진과 예술의 경계를 넘나들며 상상력을 발휘하고, 일촉 즉발의 현장에 적응하며, 무수한 마감을 버텨온 패션 사진가들이 일 년에 한번 ‘ 패션 사진가의 밤’을 주최합니다.', '', '11월 13일, 압구정 캐논 코리아에서 진행된 ‘2019 사진가의 밤’. 한장의 사진을 위해 함께 노력한 각 분야 스페셜리스트에게 고마움을 표하는 ‘올해의 아티스트’ 시상식과 함께 30여명의 패션 사진가들의 작품으로 채워진 전시도 마련되었어요. 협회의 공식 후원사 캐논 컨슈머 이미징이 그들을 격려하고 축하하며 뜻깊은 하루를 보냈답니다.', '그럼, 올해의 수상자를 만나볼까요?', '‘ 포토제닉상’을 수상한 블랙핑크 제니. 과거 화려한 수상자들, GD와 유아인, 이동욱, 크리스탈에 이어 이름을 올린 제니는 “저를 예쁘게 담아주신 실장님들께 감사의 인사를 전하고 싶어요. 감사합니다.”라며 수상 소감을 전했어요.', '', '', '', '', '‘ 특별상’을 받은 모델 김원경과 한혜진. 두 사람은 올해 데뷔 20주년이라는 모델로서 의미 있는 해를 맞이했어요. 일정상 참석하지 못한 한혜진을 대신해 모델 김원경은 ""30주년을 맞을 수 있도록 노력하겠다""는 수상소감을 전했답니다.', '', '', '‘ 신인 모델상’을 수상한 박태민과 소유정. 통통 튀는 스타일과 강렬한 인상을 남긴 소유정은 중 2 이후 처음 받는 상이라며 설렘과 기쁨을 감추지 못했고, 해외 일정으로 함께하지 못한 태민은 아쉬운 마음과 함께 영상으로 수상소감을 전했답니다.', '', '', '그리고, 패션사진가들이 뽑은 모델에게는 의미가 남다른 상, ‘ 올해의 모델상’을 수상한 박경진과 정호연! 국내는 물론 해외에서도 대활약하는 자랑스러운 그들에게는 박수가 끊이질 않았죠.', '', '', '', '', ""그리고 올해의 ‘ 패션 디자이너’로는 EENK의 이혜미, ‘ 올해의 헤어아티스트’ 강현진, ‘ 올해의 메이크업 아티스트’ 이숙경, ' 패션스타일리스트' 지은, ' 세트스타일리스트' 유여정등이 수상했어요."", '', '2000년부터 매년 패션 전시회를 개최하고 시상식을 진행해온 지 20년이 된 ‘패션 사진가의 밤’. 이를 주최하는 한국패션사진가협회(Korea Fashion Photographer Association)는 1994년 9명의 패션사진가로 시작해 올해 25주년이 되었답니다. 우리가 일상에서 접하는 수많은 패션 사진, 그 사진 한장을 위해 열정을 쏟아내는 사람들. 다가올 2020년도 <엘르>와 함께 멋진 사진과 영상을 만들어보아요. 응원할게요!', '✓전시<this is="""" fashion="""" photography=""""> 는 2020년 1월 26일까지, 11시부터 저녁 8시, 압구정 캐논 갤러리 (강남구 선릉로 829 캐논플렉스 B1층) 에서 만나볼 수 있어요. 관람료는 무료!</this>']]"|STAR|1|0|Je|E|"['[[\'\', \'\', \'\', \'선 후배 누구 할 것 없이 에디터, 모델, 스타일리스트, 헤어 & 메이크업 아티스트, 세트스타일리스트 등 함께 일해온 모두를 초대해 축하와 격려의 자리를 갖는 것이죠. 올 한해, 멋진 사진과 영상을 만드느라 수고했다는 의미!\', \'\', \'\', \'\', \'\', \'\', \'\', \'\', \'\', \'\', \'\', \'\', \'\', \'\', \'\', \'\', \'\', \'\', \'\', \'\', \'\', \'\', \'\', \'\', \'\', \'\', \'\', \'\', \'\', \'\', \'\', \'\', \'\', \'\', \'\', \'\', \'\', \'\', \'\', \'\', \'\'], [\'매달 새롭게 발간되는 <엘르>를 비롯한 수많은 잡지들과 새 계절의 시작을 알리는 광고 캠페인, 길을 가다 마주치는 스타들의 멋진 사진 한장을 위해 카메라를 드는 사람들.\', \'상업 사진과 예술의 경계를 넘나들며 상상력을 발휘하고, 일촉 즉발의 현장에 적응하며, 무수한 마감을 버텨온 패션 사진가들이 일 년에 한번 ‘ 패션 사진가의 밤’을 주최합니다.\', \'\', \'11월 13일, 압구정 캐논 코리아에서 진행된 ‘2019 사진가의 밤’. 한장의 사진을 위해 함께 노력한 각 분야 스페셜리스트에게 고마움을 표하는 ‘올해의 아티스트’ 시상식과 함께 30여명의 패션 사진가들의 작품으로 채워진 전시도 마련되었어요. 협회의 공식 후원사 캐논 컨슈머 이미징이 그들을 격려하고 축하하며 뜻깊은 하루를 보냈답니다.\', \'그럼, 올해의 수상자를 만나볼까요?\', \'‘ 포토제닉상’을 수상한 블랙핑크 제니. 과거 화려한 수상자들, GD와 유아인, 이동욱, 크리스탈에 이어 이름을 올린 제니는 “저를 예쁘게 담아주신 실장님들께 감사의 인사를 전하고 싶어요. 감사합니다.”라며 수상 소감을 전했어요.\', \'\', \'\', \'\', \'\', \'‘ 특별상’을 받은 모델 김원경과 한혜진. 두 사람은 올해 데뷔 20주년이라는 모델로서 의미 있는 해를 맞이했어요. 일정상 참석하지 못한 한혜진을 대신해 모델 김원경은 ""30주년을 맞을 수 있도록 노력하겠다""는 수상소감을 전했답니다.\', \'\', \'\', \'‘ 신인 모델상’을 수상한 박태민과 소유정. 통통 튀는 스타일과 강렬한 인상을 남긴 소유정은 중 2 이후 처음 받는 상이라며 설렘과 기쁨을 감추지 못했고, 해외 일정으로 함께하지 못한 태민은 아쉬운 마음과 함께 영상으로 수상소감을 전했답니다.\', \'\', \'\', \'그리고, 패션사진가들이 뽑은 모델에게는 의미가 남다른 상, ‘ 올해의 모델상’을 수상한 박경진과 정호연! 국내는 물론 해외에서도 대활약하는 자랑스러운 그들에게는 박수가 끊이질 않았죠.\', \'\', \'\', \'\', \'\', ""그리고 올해의 ‘ 패션 디자이너’로는 EENK의 이혜미, ‘ 올해의 헤어아티스트’ 강현진, ‘ 올해의 메이크업 아티스트’ 이숙경, \' 패션스타일리스트\' 지은, \' 세트스타일리스트\' 유여정등이 수상했어요."", \'\', \'2000년부터 매년 패션 전시회를 개최하고 시상식을 진행해온 지 20년이 된 ‘패션 사진가의 밤’. 이를 주최하는 한국패션사진가협회(Korea Fashion Photographer Association)는 1994년 9명의 패션사진가로 시작해 올해 25주년이 되었답니다. 우리가 일상에서 접하는 수많은 패션 사진, 그 사진 한장을 위해 열정을 쏟아내는 사람들. 다가올 2020년도 <엘르>와 함께 멋진 사진과 영상을 만들어보아요. 응원할게요!\', \'✓전시<this is="""" fashion="""" photography=""""> 는 2020년 1월 26일까지, 11시부터 저녁 8시, 압구정 캐논 갤러리 (강남구 선릉로 829 캐논플렉스 B1층) 에서 만나볼 수 있어요. 관람료는 무료!</this>\']]']"
숏패딩 입은 스타들의 룩 BEST 6 #옷잘입는언니|http://v.media.daum.net/v/20191209001034425|2019.12.09|http://v.media.daum.net/v/20191209001034425?f=o|"[['', '', '', ""상큼상큼! 드라마 '어쩌다 발견한 하루'를 통해 연기돌로 입지를 굳힌 에이프릴 나은. 나은이 선택한 숏패딩은? 차콜 컬러의 라코스테 제품이에요. 타탄체크가 엿보는 블루 니트와 그레이 톤의 팬츠를 매치해 차분하면서도 세련된 OOTD를 완성했네요."", '', '', '', '', '', '세련미 뚝뚝 떨어지는 데일리 룩을 선보이는 제시카가 선택한 숏패딩은 몽클레르예요. 패딩은 다소 투박하다는 인상을 깨부수는 우아한 디자인이 돋보이죠? 네크라인에 장식된 블랙 타이와 포켓 디테일 그리고 화이트 패딩의 조화가 C 브랜드의 트위드 재킷을 떠올리게 하네요. 밍크 머플러와 이너 패딩을 블랙으로 통일해 보온성과 스타일을 모두 챙긴 제시카의 센스도 눈 여겨봐 주세요.', '', '', '', '', '', '뉴발란스 숏패딩 차림의 사복 여신 배우 차정원. 옷장 속 기본 아이템인 블랙 티셔츠와 아이보리 톤의 팬츠에 카멜 톤의 패딩을 매치했어요. 컬러 때문에 온화하고 부드러운 분위기를 자아내죠? 목까지 감싸주는 하이넥 디자인이라 한층 따뜻하게 즐길 수 있다는 것도 장점이에요.', '', '', '', '', '', '반려견 휴지와 산책 타임을 즐기기 위해 강민경이 선택한 숏패딩은 바로 골스튜디오의 다운파카. 블랙 패딩에 그레이 컬러의 과감한 로고 플레이가 인상적이죠? 리버서블 디자인이라 뒤집어 입으면 심플한 블랙 패딩으로 즐길 수 있답니다. 강민경은 카멜 컬러의 비니, 레몬 컬러의 니트, 화이트 스니커즈로 컬러 포인트를 더해 따라하고 싶은 데일리 룩을 선보였어요.', '', '', '', '', '', '최근 아이슬란드로 여행을 다녀온 배우 윤승아. 버킷리스트 하나인 오로라를 보고 왔다며 기쁜 마음을 SNS에 올렸는데요. 여행을 위해 윤승아가 선택한 숏패딩은 바로 프론트로우 X 메종마레 협업 제품이었답니다. 샌드 베이지 컬러의 언밸런스한 기장(앞이 짧고 뒤가 길어요)이 돋보이는 숏패딩인데요. 탈부착 가능한 머플러 역시 스타일링의 재미를 줄 수 있는 포인트랍니다.', '', '', '', '', '', ""'이 패딩 찜' 블랙핑크 제니의 원픽 숏패딩은 바로 아디다스 제품이에요. 스포츠 브랜드답게 캐주얼하고 편안한 디자인이 돋보이죠? 블랙과 화이트 컬러 블록을 통해 포인트를 주고 가슴에는 심볼과 팔목에는 로고를 더했답니다. 와이드한 데님 팬츠에 매치할 뉴트로 스타일의 스포티한 숏패딩을 찾고 있다면 제니의 패딩이 정답!"", '', ''], ['', '', '', '', '', '']]"|FASHION|0|0|Je|E|"['\', ""\'이 패딩 찜\' 블랙핑크 제니의 원픽 숏패딩은 바로 아디다스 제품이에요. 스포츠 브랜드답게 캐주얼하고 편안한 디자인이 돋보이죠? 블랙과 화이트 컬러 블록을 통해 포인트를 주고 가슴에는 심볼과 팔목에는 로고를 더했답니다. 와이드한 데님 팬츠에 매치할 뉴트로 스타일의 스포티한 숏패딩을 찾고 있다면 제니의 패딩이 정답!"", \'']"
비니를 쓰세요|http://v.media.daum.net/v/20191124000115500|2019.11.24|http://v.media.daum.net/v/20191124000115500?f=o|[['', '', '', '머리 감기도 귀찮을 정도로 게으름이 피어나는 날에는 수지처럼 해보세요. 빵 굽는 냄새가 고소한 모닝 베이커리 쇼핑에 나선 그녀는 부스스한 헤어를 한방에 정리하는 것은 물론 초췌한 민낯을 보완해주는 비니를 선택했어요. 길쭉한 비니를 넓게 접어 올리고, 모자의 위 공간을 콘 헤드처럼 높이 올려 꾸러기처럼 스타일링하니 수수한 민얼굴이 귀엽게만 보이네요.', '', '', '', '', '', '산다라의 비니 활용법을 살펴볼까요? 선명한 오렌지 컬러의 후디와 연두색 비니로 인간 비타민 같은 상큼함을 전하는 그녀. 과감한 컬러에 또 다른 과감한 컬러로 맞서는 대담한 컬러 매칭이 비비드 컬러 마니아답네요. 헤어로 턱 라인을 슬쩍 가리고 타이트한 니트 비니를 귀까지 푹 눌러쓰면 얼굴 소멸 스타일도 연출 할 수 있어요.', '', '', '', '', '', '집업 저지와 밝은 워싱의 데님 팬츠, 화이트 스니커즈. 누구에게나 있는 흔한 아이템을 느낌 있게 연출한 비결은 비니에 있어요. 제니처럼 짧은 니트 비니의 끝을 접어 올리고 이마가 절반쯤 드러나게 쓰는 것이 포인트. 한쪽 머리만 귀 뒤로 꽂아 청순함까지 가미한 그녀는 역시 스트리트 퀸!', '', '', '', '', '', '블랙, 그레이, 네이비, 브라운…. 어두운 컬러의 아우터가 지배하는 겨울 룩에 자양강장제 같은 활력을 불어넣고 싶다면 레드 컬러의 비니가 제격! 오버사이즈 그레이 코트에 새빨간 비니로 생기를 더한 이성경처럼 토마토나 잘 익은 사과같이 채도가 높은 비니를 선택하는 것이 효과적입니다. 앞머리를 내린 채 비니를 살짝 걸쳐 쓰면 얼굴이 작아 보이는 효과까지! 올겨울 비니의 활약이 기대되는군요.', '', '', '', '', '', '넉넉한 사이즈의 후디와비니는 힙한 스트리트 무드를 완성하는 환상의 짝꿍입니다. 이주연의 룩처럼 비니에 컬러 포인트를 주면 금상첨화! 비니 끝을 넉넉히 접어 귀를 반쯤 가리는 정도로 써주기만 하면 스타일링이 완성되니 얼마나 간단하게요~.', '', ''], ['', '', '', '', '']]|FASHION|0|0|Je|E|['집업 저지와 밝은 워싱의 데님 팬츠, 화이트 스니커즈. 누구에게나 있는 흔한 아이템을 느낌 있게 연출한 비결은 비니에 있어요. 제니처럼 짧은 니트 비니의 끝을 접어 올리고 이마가 절반쯤 드러나게 쓰는 것이 포인트. 한쪽 머리만 귀 뒤로 꽂아 청순함까지 가미한 그녀는 역시 스트리트 퀸!']
[요주의 물건] #08. 겨울에 누리는 낭만, 카멜 코트 <1>|http://v.media.daum.net/v/20191120001030248|2019.11.20|http://v.media.daum.net/v/20191120001030248?f=o|[['', '', '', '', '', '', '', '', '', '', '', '', '', '', '', '', '', '', '', '', '', '', '', '', '', '', '', '', '', '', '', '', '', '', '', '▷ 영화 <나홀로 집에>의 크리스틴 민터, 1990', '', '', '', '', '', '▷ 영화 <마릴린 먼로와 함께한 일주일>의 미셸 윌리엄스, 2011', '', '', '', '', '', '▷ 영화 <미스 슬로운>의 제시카 차스테인, 2016', '', '', '', '', '', '', '', ''], ['', '아침저녁으로 코가 시리다. 밤은 점점 길어지고 한낮의 짧은 볕이 반가워진다. 이렇게 가을이 깊어 겨울을 예감하기 시작하는 날이면 나는 영화 <러브 스토리></러브>를 떠올린다. 가난한 연인과 부모의 반대, 불치병 등 멜로 드라마의 클리셰로 가득하지만, 여전히 볼 때마다 아름답고 슬픈 사랑 이야기. 영화의 첫 장면에서 남자주인공 올리버는 독백한다. “25살에 죽은 한 여자에 대해 어떻게 생각하십니까? 아름답고 총명했으며 모차르트와 바흐를 사랑했고, 비틀즈를 사랑했고, 저를 사랑했습니다.” 오, 올리버. 나라면 하나 더 말했을 텐데. “그녀는 정말로 멋진 스타일을 갖고 있었습니다.”', '내가 떠올리는 것은 영화의 고전적인 스토리 라인도, 영화음악의 거장 프란시스 레이(이 영화로 그는 1971년 아카데미 음악상을 받았다)의 애절한 멜로디도 아니다. 나는 이 영화 속 알리 맥그로의 스타일을 생각한다. 영화 속에서 그녀는 고전적인 프레피(프레피라는 단어는 영화 초반에 제니가 올리버를 놀리며 ‘금수저’라는 의미로 사용하는 단어이기도 하다) 룩을 연출하는데, 거의 50년이 지난 지금 보아도 세련된 느낌을 준다. 체크무늬 미니스커트와타이츠, 터틀넥 스웨터, 털모자, 플랫 슈즈, 실크 드레스 등, 보스턴의 추위와 싸우기 위해 여자 주인공 제니가 무장한 아이템들은 몽땅 내 옷장에 넣고 싶을 정도로 멋스럽다. 그중 가장 탐나는 건 역시 코트. 발랄한 스타일의 피코트와 크림색 캐시미어 코트 그리고 벨트가 달린 카멜 코트등이다.', '▷ 영화 <러브 스토리> 1970', '', '', '', '', '', '서론이 길어졌다. 나는 코트에 대한 나의 애정에 대해 짧게 언급하려 했을 뿐인데. 하지만 영화에 등장한 아름다운 코트에 관해서라면 조금 더 할 이야기가 남아 있다. <나 홀로 집에 2>의 마지막, 록펠러 센터의 대형 트리 앞에서 마침내 케빈과 엄마가 재회하는 신을 볼 때마다 나는 케빈 엄마의 코트를 뜯어본다. 무릎을 넉넉히 덮는 길이에 와이드 컬러, 그리고 오버사이즈 핏. 참 포근해 보이는 카멜 코트다. <나 홀로 집에 1>에서 케빈의 누나 헤더(크리스틴 민스터) 역시 카멜 코트를 입고 나왔었는데, 저것은 엄마와 딸이 공유하는 코트인 걸까? 어느 브랜드 제품일까? 하는 생각을 골똘하게, 수일 만에 다시 만나 눈물을 흘리며 포옹하는 엄마와 아들의 감정에 호응하지 못한 채 그런 불순한 생각에 빠지곤 하는 것이다.', '▷ 영화 <나홀로 집에 2>의 캐서린 오하라, 1992', '', '', '', '', '<메릴린 먼로와 함께한 일주일>에서 먼로를 연기한 미셸 윌리엄스 역시 카멜 코트를 입고 등장한다. “메릴린 먼로는 일상생활에서 매우 심플하게 입었을 거예요. 그리고 편안하게요. 자신의 직업에서 벗어났을 때 갖고 있던 모습들, 즉 단순함과 캐주얼한 우아함 같은 것, 나는 그것들을 영화 속으로 가져오고 싶었습니다.” 이 영화의 코스튬 디자이너 질 테일러(Jill Taylor)의 말처럼 영화에서 로브 스타일의 카멜 코트는 그 역할을 제대로 해낸다. 시대의 섹스 심볼이 아닌 한 ‘사람’으로 보이게 만드는 데 심 플한 디자인의 타임 리스 아이템이 사용된 것이다. 영화 <미스 슬로운>에서 냉철한 로비스트로 변신한 제시카 차스테인 역시 카멜 코트를 입고 등장한다. 화려한 액세서리를 철저히 배제한, 프로페셔널한 룩을 선보이는 데 좋은 무기로 사용되었다는 평. 이쯤 되면 궁금해진다. 시간을 초월하는 능력을 가진 이 우아한 코트는 언제 어떻게 등장했을까. 너무 흥분한 상태로 글을 쓴 나머지 서론이 지나치게 길어진 관계로 카멜 코트에 관한 남은 이야기는 다음 주에 이어서 해볼까 한다. 엘르 독자들의 따스한 이해와 인내심을 바라며, 다음 주에 만나요. 제발!♡', '☞ 트렌드를 뛰어넘어 시대를 관통하는 가치를 지닌 물건 뒤에 숨은 흥미로운 이야기, 김자혜 작가의 ‘요주의 물건’은 매주 수요일에 찾아갑니다.']]|FASHION|0|0|Je|E|['내가 떠올리는 것은 영화의 고전적인 스토리 라인도, 영화음악의 거장 프란시스 레이(이 영화로 그는 1971년 아카데미 음악상을 받았다)의 애절한 멜로디도 아니다. 나는 이 영화 속 알리 맥그로의 스타일을 생각한다. 영화 속에서 그녀는 고전적인 프레피(프레피라는 단어는 영화 초반에 제니가 올리버를 놀리며 ‘금수저’라는 의미로 사용하는 단어이기도 하다) 룩을 연출하는데, 거의 50년이 지난 지금 보아도 세련된 느낌을 준다. 체크무늬 미니스커트와타이츠, 터틀넥 스웨터, 털모자, 플랫 슈즈, 실크 드레스 등, 보스턴의 추위와 싸우기 위해 여자 주인공 제니가 무장한 아이템들은 몽땅 내 옷장에 넣고 싶을 정도로 멋스럽다. 그중 가장 탐나는 건 역시 코트. 발랄한 스타일의 피코트와 크림색 캐시미어 코트 그리고 벨트가 달린 카멜 코트등이다.']
리본 효과|http://v.media.daum.net/v/20191116000145184|2019.11.16|http://v.media.daum.net/v/20191116000145184?f=o|[['', '', '', '장미 넝쿨이 탐스럽게 프린트된 블라우스와 말린 장밋빛 MLBB로 러블리한 순간을 연출한 이사배. 하지만 예뻐지고 싶은 여자의 욕심은 끝이 없는 법이죠. 어깨에 큼지막한 리본을 달아 얼굴이 작아 보이도록 하는 스킬을 발휘했어요. 기억하세요. 얼굴 아래 커다란 리본을 달면 ‘얼굴 소멸 패션’에 동참할 수 있다는 것을.', '', '', '', '', '', '대체로 리본은 페미닌한 룩의 단골손님이죠. 하지만 이번 시즌 리본은 시크한 룩에도, 섹시한 룩에도 사용되고 있어요. 어깨가 강조되는 블랙 재킷을 이너 없이 원피스처럼 입고 가슴골을 살짝 드러낸 룩에 작은 리본 벨트를 더한 한예슬의 스타일처럼 말이죠. 한계 없는 리본 활용의 좋은 예가 되어주고 있네요.', '', '', '', '', '', '도도한 표정과 포즈로 침대에 걸터앉은 제니의 모습에서 사랑스러운 소녀의 이미지가 떠오르는 이유는 바로 커다란 리본 장식의 톱 덕분입니다! 리본 가운데 장식된 하얀 코르사주가 순수하고 로맨틱한 무드를 극대화하고 있어요. 로맨틱한 톱과 밝은 컬러로 워싱한 데님 팬츠가 잘 어울리죠?', '', '', '', '', '', '우리가 알던 패왕색 현아는 어디에? 양 갈래로 땋은 머리에 커다란 리본을 묶어 개구쟁이 10대 소녀 같은 귀여움을 보여주는 그녀! 할머니 옷장에서 꺼낸 듯, 알록달록한 꽃무늬 톱도 그녀가 입으니 스타일리시하네요. 익살스러운 표정으로 반려견 소금이와 같은 곳을 바라보는 모습이 포토제닉합니다.', '', '', '', '', '', '카리스마 넘치는 퍼포머 선미의 반전 매력 감상해보세요. 선미는 오늘 얌전한 요조숙녀를 컨셉트로 했나 봅니다. 평범한 아이보리 컬러의 스웨터에 커다란 리본을 달고 여성스럽게 미소 짓고 있는 그녀. 6:4 가르마를 타고 곱게 빗어넘긴 헤어도, 잡티만 커버한 단아한 메이크업도 모두 잘 어울리네요.', '', '', '', '', '', '아침에 일어나 거울에 비친 얼굴이 유난히 초췌하다면? 지민처럼 리본 헤어 밴드를 활용해보세요. 피곤함에 지쳐 미처 수습하지 못한 ‘생얼’도 청초한 이미지로 커버해줄 테니까요. 화려한 패턴의 톱과 커다란 리본에 시선을 빼앗긴 사람들은 당신의 맨얼굴을 안쓰러워하지 않을 거예요.', '', ''], ['', '', '', '', '', '']]|FASHION|0|0|Je|E|['도도한 표정과 포즈로 침대에 걸터앉은 제니의 모습에서 사랑스러운 소녀의 이미지가 떠오르는 이유는 바로 커다란 리본 장식의 톱 덕분입니다! 리본 가운데 장식된 하얀 코르사주가 순수하고 로맨틱한 무드를 극대화하고 있어요. 로맨틱한 톱과 밝은 컬러로 워싱한 데님 팬츠가 잘 어울리죠?']
