title|link|date|elle_link|contents|category|title_name|check
나만 알고 싶은 SNS 빈티지 숍 3|http://v.media.daum.net/v/20190708103340102|2019.07.08|http://v.media.daum.net/v/20190708103340102?f=o|"[['', '', '', '', '', '', '@our_studio_', '', '', '', '', '', '', '@de_arles', '', '', '', '', '', '', '@pluie_'], [""집 꾸미기, 인테리어 덕후를 자처하는 에디터의 SNS 팔로잉 리스트를 공개해요. 보는 순간 '어머 이건 사야 해!'를 외치게 되는 빈티지 소품들을 만나볼 수 있는 계정들이죠. 빈티지의 특성상 '원 & 온리'이기 때문에 쇼핑에 필요한 건 바로 다름 아닌 스피드! 선착순 1등에 들고 싶어지는, 오롯이 나만 알고 싶은 빈티지 숍 계정만 모았어요."", '', '', '', ""마티스와 피카소 등 유명 화가들의 페인팅 액자로 이름을 알린 ' 아우어 스튜디오'예요. 이후 빈티지 오브제를 소개하며 인스타그램에서 유명세를 얻고 있죠! 아우어 스튜디오의 주력 아이템은 다름 아닌 빈티지 램프. 테이블 램프를 포함해 벽 등 램프까지 다채로운 디자인의 빈티지 오브제를 만나볼 수 있답니다. 조명은 인테리어에서 '신스틸러' 같은아이템인데요. 식탁이나 커피 테이블, 침대 옆 사이드 테이블에 두는 것만으로도 공간의 분위기를 근사하게 만들어주는 기특한 오브제죠. 아우어 스튜디오에서 소개하는 70, 80년대의 우든 램프(플리츠처럼 주름 잡힌 갓이 특징!)나 조개나 튤립이 떠오르는 독특한 쉐이프의 세라믹 램프를 눈여겨보세요!"", '', '', '', ""매거진랙, 램프, 캔들 홀더 등 다양한 빈티지를 판매하는 ' 드 아를'입니다. 이중에서 에디터가 주목한 것은? 바로 테이블웨어예요. 과하지 않고 은은하면서 '갬성' 충만한 그릇과 커트러리를 만나볼 수 있는 계정이에요. 파리 방브 빈티지 마켓에서 발견했을 법한 빈티지한 버터나이프와 브라운 & 네이비 조합의 플레이트와 소서 등등. 노릇하게 구운 식빵과 제철 과일을 올려놓고 예쁜 사진 한장 찍고 싶어지는 테이블웨어를 만나볼 수 있답니다. 또 최근엔 로제 와인을 담으면 좋을 빈티지 와인잔도 업데이트 중! 부피가 큰 가구와 달리 테이블웨어는 손쉽게 구입할 수 있는 오브제라 빈티지 초보자에게도 추천해요. 우리 집 식탁의 풍경을 멋스럽게 바꾸고 싶다면, 지금 바로 팔로잉해보세요."", '', '', '', ""'예쁜 게 최고야!'를 외치는 에디터의 마음을 심쿵하게 만든 숍 ' 플뤼'예요. 집 리모델링 이후 지인에게 빈티지 보석함을 선물 받았는데 바로 이곳의 제품이었죠. 각기 다른 플로럴 패브릭 패턴(인상파 화가들의 그림처럼 아름다워요)과 알찬 구성의 빈티지 보석함은 오롯이 하나뿐이랍니다. 그래서 빈티지 보석함 판매를 기다리는 팬들이 많은 계정이기도 하죠. 6, 70년대 생산된 보석함이라 약간의 크랙과 사용감이 있지만, 빈티지에 대한 이해도가 높은 팬들은 이런 부분도 쿨하게 OK! 보석함뿐만 아니라 빈티지 계산기, 턴테이블, 뮤직박스 등 웨스 앤더슨 영화 속 소품 같은 오브제들도 만날 수 있는 곳이랍니다. 연남동에 오프라인 숍이 있지만, 비정기적으로 오픈하므로 방문 전 인스타그램을 꼭 확인하세요.""]]"|LOVE&LIFE|0|0
신민아, 샤넬 뷰티 앰버서더가 되다|http://v.media.daum.net/v/20190701100957816|2019.07.01|http://v.media.daum.net/v/20190701100957816?f=o|[['', '', '', '', '', '', '', '', '', '', '', '', '', '', '', '', '', '', '', '', '', '', '', '', '', '', '', '', '', '', '', '', '', '', '', '', '', '', '', '', '', '', '', '', '', '', '', '', '', '', '', '', '', '', '', '', '', '', '', '그저 바라보는 것만으로 힐링이 되는 사람이 있다. 에디터에게는 신민아가 그랬다. 샤넬 뷰티의 공식 앰배서더로서 진행한 첫 촬영. 촬영장에서 만난 그녀는 ‘힐링’으로 모자라 ‘홀리’해지는 경험을 스태프들에게 선사했다. 새로 출시된 울트라 르 뗑으로 완성한 흠잡을 데 없는 그녀의 피부는 단아하면서도 기품 있게 빛나는 유백색의 조선 백자를 연상시켰고 담백한 오브제 사이에서 포즈를 취하던 순간,그녀 주변을 둘러싸고 있던 공기마저 청정하게 정화되는 듯했다. 마냥 두고두고 감상하고 싶은 한 폭의 아름다운 초상화 같은 A컷들과 함께 비하인드 컷을 공개한다. 신민아가 전해주던 초여름의 기분 좋은 보송보송함을 당신도 느낄 수 있길.', '', '', '', '', '', '', '', '', '', '', '', '', '', '', '', '', '', '', '', '', '', '', ''], ['', '', '', '', '', '', '', '', '━', 'Behind the Scenes', '', '', '', '', '', '', '', '']]|STAR|0|2
채식주의자를 위한 레스토랑 5|http://v.media.daum.net/v/20190521133435438|2019.05.21|http://v.media.daum.net/v/20190521133435438?f=o|[['', '', '', '', '', '', '플라워 숍이라는 착각이 들 정도로 푸릇푸릇한 외관. 채식을 지향하는 브런치 레스토랑이자 스페인 안주가 있는 와인 바이기도 한 보타닉힐이 2월 말, 연희동 골목에 소리 소문 없이 자리를 틀었다. 주문이 들어오면 최나용 셰프가 가벼운 손놀림으로 음식을 만들고 손지선 대표는 손님들과 도란도란 이야기를 나누는 게 이곳 풍경. 맛있고 저렴하면서도 건강한 요리를 만드는 데 집중하고 싶었기에 두 사람은 하나의 메뉴를 두고도 다양한 버전을 실험했고, 그 결과 고기를 흉내 낸 재료 없이도 든든한 한 끼가 될 통베지볼 메뉴가 탄생했다. 병아리콩을 으깨 만든 후무스 위에 아스파라거스, 표고버섯, 가지, 통콜리플라워까지 아낌없이 올린 후 커민 시드와 레몬 갈릭 드레싱으로 향긋하게 마무리한 요리. 불에 구워 한결 쫄깃해진 채소들을 천천히 골라 먹다 보면 어느새 배가 불러온다. 보타닉힐의 모든 메뉴는 와인과도 근사하게 어우러지기 때문에 너무 이르지 않다면 스패니시 와인 한 잔을 곁들이는 것도 좋은 선택일 것.', '', '', '', '', '진정한 변화는 깨달음에서 오는 모양이다. 르 코르동 블루를 졸업한 후 11년 넘게 요리를 해온 이상혁 셰프는 불규칙하고 잘못된 식생활로 병에 걸리는 동료들을 보며 더욱 건강한 음식을 만들어야겠다는 다짐을 했다. 오랜 생각 끝에 찾은 답은 채식. 4년 전부터 지금의 아내와 함께 국경을 넘나들며 채식 식당 투어를 다닌 끝에 정육점과 고깃집이 즐비한 석촌호수 부근에 지금의 씨젬므쥬르를 오픈했다. 프랑스 가정식이면서 한국인의 입맛에도 맞는 이곳의 채식 요리는 상큼하기보다 강렬한 맛에 가까운 것이 특징. 양파와 마늘, 버섯으로 맛과 향을 극대화한 토마토소스에 무가당 두유를 살짝 섞은 로제 파스타는 버터와 치즈 없이도 충분히 부드러우며 김치찌개의 감칠맛도 얼핏 감돈다. 메인 요리를 주문하면 웨지 감자와 달콤한 번트 바나나도 함께 맛볼 수 있는데 이런 정성에도 불구하고 모든 메뉴가 1만원대 초반이라는 점도 이곳을 꾸준히 찾고 싶은 이유 중 하나다.', '', '', '', '', '‘아비 부’에 ‘흙 토’. 이름에서부터 흙에 대한 애정이 물씬 풍기는 이곳은 임희원 셰프가 한국에 낸 첫 번째 공간으로 5월에 정식 오픈을 앞두고 있다. 한남동이라는 입지, 한식과 와인의 페어링이라는 유망한 컨셉트 말고도 눈에 띄는 건 재료가 어디에서 왔는지를 알고 음식을 즐길 수 있는 곳이라는 점. ‘모든 재료는 흙에서 나온다’는 그의 믿음에 따라 부토의 모든 식재료는 지정한 농장에서 빈틈없는 유기농법을 거쳐 수확한 것으로 간장, 된장처럼 한식에서 빼놓을 수 없는 소스 종류까지 직접 담근다. 건강한 기운이 폴폴 느껴지는 메뉴 중에서도 특히 눈길을 끄는 건 베지테리언 사시미. 참치 등살같이 생긴 비트, 오미자에 절인 마, 조개와 비슷한 식감의 흰목이버섯, 바다 향이 그윽한 톳이 한데 모인 외양이 회 한 접시를 그대로 빼닮았다. 비트와 아보카도를 구운 김에 싸서 회 간장에 찍어 먹으면 실제로 회를 먹는 느낌이 든다는 손님도 심심찮게 있을 정도. 함께하면 좋은 술로는 풍부한 미네랄이 느껴지는 화이트 와인을 추천한다.', '', '', '', '', '채식주의자들에겐 채식 전문 식당이 늘어나는 것만큼이나 비건 메뉴가 있는 일반 식당이 많아지는 것도 기쁜 소식이 아닐까. 최근 프랜차이즈 만두 전문점 귀일교자로부터 들려온 희소식. 두 달 전 논현동에 가게를 오픈하며 비건 메뉴인 머시룸큐브교자를 내놓은 것이다. 건강관리에 관심이 많은 조서진 대표는 ‘만두엔 고기’라는 인식을 깰 식물성 만두를 만들고 싶었고, 많은 후보 중에서도 씹히는 맛이 특히 좋은 새송이버섯을 주재료로 간택했다. 오도독오도독한 새송이버섯에 부추와 대파를 버무린 속을 강황 섞인 만두피로 감싼 머시룸큐브교자는 정확히 6분 40초 동안 찜기에서 열을 쬔 뒤 테이블로 배달되는데 혼자 한 판을 다 먹어도 더부룩함 없이 깔끔한 느낌. 현재 논현점을 비롯해 이태원점과 충주점에서만 맛볼 수 있는 메뉴다.', '', '', '', '', '해방촌 꼭대기에 얼마 전 문을 연 작은 사찰 소식. 식당의 테마를 사찰로 정하자마자 똑같이 철학을 공부한 세 대표의 관심은 자연스럽게 사찰이 품은 정신으로 향했다. ‘동물에게 피해를 주지 않으며 재료의 소중함을 아는 식문화를 조성할 것.’ 동시에 마늘과 파처럼 자극적인 향이 나는 오신채를 금하는 불교의 금욕 정신을 굳이 강조하지 않는 이유는 이곳에서만큼은 젊은이들이 해방감을 느끼길 바라는 너그러운 마음에서다. 구운 가지에 캐슈너트, 흑마늘로 만든 치즈를 올리고 식용 숯가루를 뿌려 마무리한 아무스 부시, 불 향을 머금은 달착지근한 콩고기와 약주 칠레 퓌레, 신선한 제철 채소를 더한 속세의 유혹처럼 소식의 비건 메뉴들은 충분히 달고 짜다. 여기에 전통주까지 곁들일 수 있음은 물론이다. 미래적 음악이 흐르는 실내와 묵언보다 사람 사이의 소통과 대화를 권장하는 분위기가 자신의 소신만 지켜낸다면 얼마든지 즐기며 살아도 좋다고 말하는 듯하다.'], ['━', '보타닉힐', '', '', '', 'add 서대문구 연희맛로 17-14', '@botanic_heal', '━', '씨젬므쥬르', '', '', 'add 송파구 백제고분로41길 25', '@sixieme_jour', '━', '부토', '', '', 'add 용산구 한남대로27가길 32', '@buto_hannam', '━', '귀일교자', '', '', 'add 강남구 강남대로 524', 'tel02-3443-4002', '━', '소식', '', '', 'add 용산구 신흥로 57', '@soseekseoul']]|LOVE&LIFE|0|0
아묻따 '쿨톤'이라면!|http://v.media.daum.net/v/20190430131629792|2019.04.30|http://v.media.daum.net/v/20190430131629792?f=o|[[], ['쿨톤 피부 모델 이유진의 하얗고 맑은 피부를 더욱 돋보이게 만들어주는 쿨톤 뷰티 아이템은 무엇일까?', 'I AM COOL', '', '앗 차가워! 베이스는 이렇게 이영애, 김옥빈, 아이린은 대표적인 쿨 톤 피부의 아이콘. 피부에 핑크빛이 맴돌거나 푸르스름한 편이며 백옥 같이 투명하고 깨끗하게 느껴진다. 북유럽 귀족처럼, 뱀파이어처럼 말이다. 헷갈린다고? 웜 톤, 쿨 톤, 뉴트럴 톤의 파운데이션을 조금씩 펌핑해 보자. 이렇게 비교해 보면 확실히 티가 나는데, 쿨 톤 파운데이션은 묘하게 분홍빛이 도는 게 느껴질 것이다. 하지만 자칫 창백하고 아파 보일 수 있기 때문에 파우더 타입을 곧장 사용해 더욱 푸석하게 보이기보다 촉촉한 리퀴드 타입으로 피부 전체를 보정하고, 파우더는 이를 고정하는 용도로 가볍게 터치하기를 권한다.', '', '', '(왼쪽부터) 농축 세럼 성분이 피부에 밀착돼 고급스럽게 빛나는 인텐시브 스킨 세럼 파운데이션 SPF 40/PA+++, 1.25 쿨 아이보리, 8만5천원대, Bobbi Brown. 매끈하고 촉촉하게 연출되는 프로 테일러 파운데이션 비 글로우 SPF 25/PA++, 24C 샐먼, 28C 딥, 26C 허니, 22C 페탈, 각 3만8천원, Espoir. 피부에 생기를 더하는 복숭아 쿠션은 르 블랑 브라이트닝 젠틀 터치 파운데이션 SPF 30/PA+++, N° 12 베쥬 로제, 8만1천원, Chanel.', '', '여기 쿨 톤 한 스푼 추가요! 핏기 없어 보이는 것이 쿨 톤 피부의 단점. 혈색을 더하는 블러셔가 해결책이 돼줄 것이다. 오렌지보다는 핑크와 라벤더 블러셔가 얼굴이 화사해 보인다는 사실! 아이 메이크업을 생략하더라도 블러셔만큼은 반드시 사용해 이를 보완해야 한다. 혈색을 불어넣는 또 하나의 비밀병기는 바로 립스틱. 블러셔와 마찬가지로 푸시아 핑크나 퍼플 핑크, 체리 레드 립스틱이 쿨 톤의 매력을 북돋아줄 것이다. 음영 메이크업에 도전하고 싶다면? 브라운보다 그레이, 블랙 섀도를 선택할 것.', '', '', '(왼쪽부터) 펄이 반짝이는 9가지 쿨 톤 아이섀도가 담긴 폴라 아이스 아이 팔레트, 14만원, Chantecaille. 블루빛이 감도는 쿨 핑크 블러셔는 루즈 블러쉬, 475 로즈 카프리스, 6만원대, Dior. 가벼운 에어리 매트 텍스처가 번지듯 부드럽게 블렌딩된다. 푸시아 컬러의 파우더 키스 립스틱, 벨벳 펀치, 3만1천원대, MAC. 과즙을 올린 듯 맑은 반투명한 발색의 매니큐어는 네일 라커 젤리, PE06, 5천원, 3CE.', '', '쿨 톤의 인생 머리 쿨 톤 피부의 눈동자 컬러는 대체적으로 브라운보다는 회갈색이나 검정에 가깝다. 아이보리나 베이지보다 블랙, 화이트 의상이 잘 어울리는 것도 이 때문이다. 모발 컬러 역시 옐로 브라운보다 레드 브라운이, 브라운보다 흑발이 어울리는 편. “쿨 톤 피부는 염색 약에 애시라는 단어만 들어가면 모두 어울린다고 착각하기 쉽죠. 하지만 애시의 종류도 여러 가지라 모두 쿨 톤에 어울린다고 볼 수는 없어요. 애시 그레이, 애시 블론드, 블루 블랙, 퍼플 브라운을 선택하면 밝고 활기찬 쿨 톤 피부가 더욱 예쁘게 강조될 거예요.” 헤어 아티스트 신유진 실장의 조언대로 노란 기를 쫙 뺀 차가운 계열을 선택한다면 단번에 쿨 톤 여신으로 거듭날 것이다.', '', '(왼쪽부터) 도도하고 신비로운 회색빛의 비쥬드 헤어 컬러 크림, 샌드 애시 그레이, 4천6백원, Mediheal. 브러시가 동봉돼 더욱 간편한 카키색 염모제는 컬러리스타 페인트, 브론즈, 1만4천원대, L’oreal Paris.', '사진 이경진, 전성곤, COURTESY OF GUERLAIN', '에디터 천나리', '모델 라지원, 이유진', '헤어 신유진', '메이크업 이숙경', '스타일리스트 로경언', '메니큐어 김선경', '디자인 전근영', '<!--@ServiceURL:http://www.elle.co.kr/article/view.asp?MenuCode=en010203&intSno=23078-->']]|BEAUTY|0|0
태연, 반짝반짝 빛나는|http://v.media.daum.net/v/20190415111657694|2019.04.15|http://v.media.daum.net/v/20190415111657694?f=o|[[], ['소녀시대 태연의 입술에 플래쉬를 터뜨린 립스틱. 단 한 번의 터치로 강렬한 팝 컬러와 눈부시게 빛나는 미러 샤인 효과를 얻을 수 있는 샤넬의 루쥬 코코 플래쉬다', '', '컬러 블로킹이 포인트인 PVC 원피스는 Chanel. 투명한 이어링은 Baebae.', 'NEON ORANGE오렌지 한 입 베어 문 듯 새콤한 과즙미 가득! 보송함과 화사함을 동시에 잡는 르 블랑 브라이트닝 쿠션을 바른 뒤 쥬 꽁뜨라스뜨, 76 프리볼을 눈꺼풀에 살짝, 그리고 광대뼈 앞쪽 중심으로 둥그렇게 펼쳐 발라 소녀스러운 느낌을 더한다. 형광빛이 도는 오렌지 컬러의 루쥬 코코 플래쉬, 60 비트를 입술에 발라 오렌지 과즙 머금은 느낌으로 완성. 사용 제품은 모두 Chanel.', '', '트위드 슬리브리스 톱은 Romanchic. 더블 C 로고의 서클 이어링은 Chanel.', 'POMEGRANATE RED새빨간 석류 열매를 입술에 옮겨놓은 듯. 내추럴한 광채를 표현하는 일명 ‘복숭아 메베’, 르 블랑 라이트 크리에이터 브라이트닝 메이크업 베이스, 로제를 얇게 바르고 브라운 펜슬 라이너를 양볼과 콧잔등에 불규칙하게 콕콕 찍어 귀여운 주근깨를 연출한다. 눈썹 결만 촘촘하게 살려 최대한 퓨어한 느낌을 살린 뒤 입술에 루쥬 코코 플래쉬, 92 아무르를 여러 번 덧발라 석류 레드 컬러로 반짝이는 플럼핑 립을 표현. 사용 제품은 모두 Chanel.', '', '네크라인에 컬러플한 비즈 디테일을 더한 트위드 원피스는 Chanel.', 'BUBBLE GUM PINK보기만 해도 입 안 가득 달달함이 느껴지는 풍선껌 핑크 룩.', '파스텔 핑크에 화려한 실버 펄이 가미된 옹브르 프리미에르 크림 아이섀도, 808 리라스 도르를 쌍꺼풀 안쪽 라인에 얇게 발라 눈을 깜빡일 때마다 화려한 펄이 빛에 반사돼 반짝거리도록 연출한다. 레 베쥬 헬시 글로우 쉬어 컬러 스틱, 21호를 관자놀이부터 안쪽을 향해 발라 핑크빛으로 상기된 두 뺨을 완성한 다음 루쥬 코코 플래쉬, 72 러쉬를 입술 안쪽 중심으로 발라 자연스럽게 그러데이션한다. 사용 제품은 모두 Chanel.', '', '', '폴카 도트 패턴의 샤 블라우스는 Erdem by Mue. 로고 장식의 참이 달린 체인 목걸이는 Chanel.', 'JUICY PLUM농익은 서양 자두의 짙은 보랏빛을 닮은 쥬이시 립. 르 블랑 브라이트닝 쿠션을 얇게 두드려 바르고 디멘션 얼팀 드 샤넬 마스카라, 10 느와르 뿌르 퓨어 블랙을 위아래 속눈썹에 한 올 한 올 꼼꼼히 발라준다. 살짝 뭉친 듯 연출해도 좋다. 청키한 속눈썹과 어울리는 짙은 플럼빛의 루쥬 코코 플래쉬, 96 페노멘을 입술 가득 메워 바르고 안쪽 중심으로 다시 한 번 덧발라 발색과 광택을 더하면 완성. 사용 제품은 모두 Chanel.', '', '커다란 칼라 장식이 포인트인 슬리브리스 블라우스는 Romanchic. 브로치처럼 연출한 이어링은 모두 Chanel.', 'JUST-PICKED RASPBERRY', '라즈베리 핑크로 물든 입술에서 풍기는 와일드하면서도 새초롬한 느낌. 레 꺄트르 옹브르, 228 띠쎄 깡봉의 딸기 우윳빛 섀도를 눈꼬리 부근에 블렌딩하고 바움 에쌍씨엘 글로우 스틱, 트랜스페어런트를 눈머리와 눈썹 뼈 부근에 톡톡 두드려 바른다. 콧등과 인중, 턱끝에도 가볍게 터치해 얼굴 전체에 화사한 미러 효과를 부여할 것. 여러 가지 핑크 톤으로 반짝이는 셀로판지를 작게 오려 눈꺼풀에 붙여준 다음 루쥬 코코 플래쉬, 91 보헴을 바르면 갓 딴 산딸기처럼 탐스러운 입술 완성. 사용 제품은 모두 Chanel.', 'BEHIND THE SCENES눈앞에서 플래시가 터진 듯 빛나는 광채, 마른 입술에 발라도 스르르 녹아들듯이 밀착돼 각질까지 잠재우는 촉촉한 발림성, 단 한 번의 터치로 완성되는 선명한 발색. 이 모든 걸 갖춘 샤넬의 봄 신상 립스틱 ‘루쥬 코코 플래쉬’가 소녀시대 태연과 만났다. 무대 위의 완벽한 모습부터 인스타그램이나 유튜브 채널 ‘탱구TV’를 통해 팬에게 친근하게 다가오는 소탈한 모습까지, 언제 어디서든 그 자체로 빛나는 태연과 샤넬 루쥬 코코 플래쉬와의 환상적인 ‘케미’라니! 당신이 ‘태연 덕후’든 ‘립스틱 덕후’든 심장 쫄깃해질 준비하고 봐야 할 A컷 같은 B컷들을 공개한다. 이와 함께 태연이 ‘픽’한 루쥬 코코 플래쉬 다섯 가지 메인 컬러도 놓치지 말길.', '', '눈부시게 빛나는 미러 효과로 더욱 쨍하게 빛나는 네온 오렌지. 봄부터 여름까지 바르기 좋을 루쥬 코코 플래쉬, 60 비트, 4만4천원.', '', '식물성 버터와 오일의 완벽한 조합으로 빛나는 샤인 효과를 선사하는 석류 레드 컬러. 루쥬 코코 플래쉬, 92 아무르, 4만4천원.', '', '입술에 닿는 순간 부드럽게 녹아드는 멜팅 텍스처. 베이비 핑크빛의 루쥬 코코 플래쉬, 72 러쉬, 4만4천원.', '', '대담한 플럼 컬러에 은은한 반짝임이 더해져 더욱 시선을 잡아 끈다. 루쥬 코코 플래쉬, 96 페노멘, 4만4천원.', '', '얼핏 봤을 땐 여성스럽지만 바르면 야생 산딸기 같은 반전 매력을 연출하는 라즈베리 핑크. 루쥬 코코 플래쉬, 91 보헴, 4만4천원, 모두 Chanel.', '사진 김외밀', '에디터 정윤지', '메이크업 서옥(Oui Oui Atelier)', '헤어 김꽃비(Oui Oui Atelier)', '스타일리스트 정희인', '세트스타일리스트 김경민(Les Bois)', '디자인 전근영', '<!--@ServiceURL:http://www.elle.co.kr/article/view.asp?MenuCode=en010201&intSno=23023-->']]|BEAUTY|0|0
받고 싶은 결혼 선물 리스트|http://v.media.daum.net/v/20190318133847543|2019.03.18|http://v.media.daum.net/v/20190318133847543?f=o|[[], ['가격대별 좋은 취향과 센스를 담았다. 두고두고 기쁨이 될 받고 싶은 결혼 선물 리스트', '', '따뜻함을 전하는 브론즈 컬러의 AI 시스템인 구글 어시스턴트 기능이 탑재된 베오사운드 스피커는 86만원, Bang & Olufsen.', '', '스파받을 시간도 부족한 ‘예신’의 피부에 생기를! 120개 LED 램프가 피부 탄력을 가꿔준다. 더마 LED 마스크는 79만9천원, Pra. L.', '', '심플한 디자인이 어떤 인테리어에도 부담 없이 어울린다. 미세 먼지와 바이러스, 탈취까지 가능한 고성능 필터의 공기청정기는 69만9천원, Balmuda.', '', '‘향긋한 모닝 커피와 아침을 깨워주는 달콤한 입맞춤~’이라고 노래하는 가사처럼 포근한 일상을 완성해줄 레트로 디자인의 49만8천원, De’longhi.', '', '80년대 레트로 컨셉트로 빈티지 컬러 배색이 고급스러운 수제 러그는 44만9천원(800mm), Five & Dime.', '', '스마트한 디자인으로 신혼부부 ‘필수템’으로 등극했다. 모발 손상을 줄이는 동시에 다양한 애플리케이터가 함께 구성돼 사용이 편리한 슈퍼소닉™ 푸시아/아이언 드라이어는 44만9천원, Dyson.', '', '군더더기 없는 디자인이 오래 두고 보기에도 고급스럽다. 호두나무 원목으로 제작된 테이블 거울은 42만원, Monette.', '', '두 사람의 공간을 향으로 가득 채워줄 디럭스 캔들 라임 바질 앤 만다린은 30만3천원, 캔들의 그을림을 최소화하기 위해 필요한 윅 트리머는 6만5천원, 모두 Jo Malone London.', '', '곡선 디자인과 라탄 소재가 배색된 원목 체어는 36만원, Lsh-furniture.', '', '자두 나무로 제작된 원목 손잡이에 전통적인 리벳 장식이 매력적이다. 비스트로 타입의 커트러리 기프트 세트는 23만원대, Robert Herder by Studio June.', '', '호텔 느낌 물씬! 신혼 선물로 제격인 타월 로브는 20만원대, Ugg.', '', '앤디 워홀의 작품이 프린트된 언더웨어는 리미티드 에디션으로 톱은 6만9천원, 브리프 각 3만9천원, 4만5000원, 커플 속옷 세트는 15만3천원, Calvin Klein Underwear.', '', '신혼의 에티켓을 위한 화장실 냄새 탈취제와 룸 스프레이, 핸드 워시가 구성된 기프트 세트는 아틀라스 오브 어트랙션 퍼밀리어 호라이즌, 12만9천원, Ae-sop.', '', '두 사람이 하나됨에 축배를! 과일 향의 샴페인은 로제 트레저드 타이 리미티드 에디션으로 10만원대, Moet & Chandon.', '', '복숭아와 가지, 러브 보트 등 달콤한 향과 귀를 간지럽히는 소리가 가득한 배스 밤 세트. 아이 하트 배씽, 8만원, Lush.', '', '신혼 분위기가 물씬 풍기는 플로럴 장식의 세라믹 액자는 왼쪽 3만9천원, 오른쪽 2만9천원, 모두 Zara Home.', '', '일러스트레이션이 새겨진 컬러 글라스 세트는 각 4만8천원 (4개들이 선물 세트 19만2천원), Still Life by Chapter1.', '에디터 김지혜, 이재희', '사진 우창원', '디자인 이효진', '<!--@ServiceURL:http://www.elle.co.kr/article/view.asp?MenuCode=en010402&intSno=22894-->']]||0|0
