title|link|date|elle_link|contents|category|title_name|check|member|magazine|word_jenny
김나영부터 지수까지! 진주 주얼리를 한 스타들|http://v.media.daum.net/v/20201126070033106|2020.11.26|http://v.media.daum.net/v/20201126070033106?f=o|[[], ['', '쇄골 라인에 걸리는 진주 목걸이의 클래식한 매력을 캐치한 제니. 화이트 셔츠와 블랙 컬러의 테일러드 재킷에 진주 목걸이를 매치해 세련되게 연출했습니다. 진주 주얼리에 도전해보고 싶다면 어떤 룩에든 자연스럽게 어울리는 간결한 진주 목걸이부터 시작해보세요.', '', '김나영은 캐주얼한 프린트 티셔츠와 데님 팬츠에 허리 라인까지 내려오는 긴 진주 목걸이를 매치했어요. 이런 스타일은 쇄골 라인에 걸쳐지는 짧은 목걸이보다 더 화려하고 성숙한 느낌을 줄 수 있죠. 목에 두 번 감아 짧게 연출할 수도 있으니 일석이조!', '', '진주 주얼리가 얌전하다는 고정관념은 이제 버리셔도 좋습니다. 볼륨감 있는 진주 주얼리는 섹시하고 대담한 이미지를 줄 수 있거든요. 진주 목걸이를 목에 딱 맞는 초커 스타일로 레이어드하고 귀여운 꽃 모티프의 펜던트가 잘 보이게 아래로 늘어뜨려 화려하게 연출한 전소미의 스타일을 참고하세요.', '', '지수의 언밸런스한 이어링에 주목해보세요. 한쪽 귀엔 작고 심플한 진주 이어링을, 다른 쪽 귀엔 진주를 체인으로 연결한 드롭 이어링을 선택했습니다. 이렇게 각기 다른 스타일의 진주 이어링을 믹스하면 통일감은 유지하면서 센스 넘치는 연출을 할 수 있어요.', '', '다라는 핸드폰을 액세서리처럼 적극 활용하고 있어요. 진주와 체인이 믹스된 크로스 보디 형태의 핸드폰 스트랩을 연결하고 화려한 패턴의 케이스를 장착해 진주의 무궁무진한 활용법을 제시합니다.', '', '예리는 진주 목걸이 대신 헤어 밴드를 선택했어요. 단정하게 정리한 긴 생머리에 촘촘하게 꿴 진주 헤어 밴드를 더해 클래식한 매력을 극대화했죠. 골드 버튼 포인트의 니트 원피스와 군더더기 없는 사각 백으로 우아하게 연출한 오늘의 룩과도 잘 어울리네요.', '* 잔나비, 사이먼도미닉, 이성경, 이제훈, 박정민, 코드 쿤스트가 함께한 뮤직 프로젝트 보기']]|FASHION|0|0|Je|E|['쇄골 라인에 걸리는 진주 목걸이의 클래식한 매력을 캐치한 제니. 화이트 셔츠와 블랙 컬러의 테일러드 재킷에 진주 목걸이를 매치해 세련되게 연출했습니다. 진주 주얼리에 도전해보고 싶다면 어떤 룩에든 자연스럽게 어울리는 간결한 진주 목걸이부터 시작해보세요.']
공효진부터 제니까지! 스타들의 #니트 활용법|http://v.media.daum.net/v/20201123070034440|2020.11.23|http://v.media.daum.net/v/20201123070034440?f=o|[['「 #케이블 니트 」', '「 #케이블 니트 」', '', '', '', '입체적인 꼬임 패턴이 매력적인 케이블 니트는 클래식 중 클래식. 유행 없이 입을 수 있어 옷장 속에 마련해두면 오래도록 입을 수 있는 아이템이죠. 단순한 꽈배기 무늬부터 다양한 꼬임을 믹스한 디자인까지 다양한데요, 어떤 디자인을 선택하느냐에 따라 그날의 분위기를 좌우할 수 있어요. 잔잔한 케이블 패턴의 핑크색 카디건에 넉넉한 데님 팬츠를 매치해 90년대 뉴트로 룩을 완성한 황승언과 부위별로 다채로운 패턴이 리드미컬하게 배열된 케이블 스웨터에 블랙 팬츠와 선글라스로 시크함을 강조한 공효진. 모두 케이블 니트를 선택했지만, 확실히 달라 보이죠?', '「 #오버사이즈 니트 」', '「 #오버사이즈 니트 」', '', '', '', '니트가 주는 포근한 분위기를 만끽하고 싶다면 오버사이즈 니트가 제격입니다. 윤승아는 큼지막한 멜란지 그레이 컬러의 스웨터에 블랙 레깅스로 웨어러블한 스타일을 즐겼는데요, 여기에 컬러플한 크로스보디 백을 더해 귀엽게 마무리했어요. 주말 집 앞 산책 룩으로도 좋을 것 같네요. 제니는 레터링 장식의 블랙 터틀넥 스웨터를 미니 원피스처럼 연출하고 사이 파이 선글라스를 더해 쿨하게 즐겼습니다. 슈즈로사이 하이 부츠를 선택한다면 트렌디하게 연출할 수 있을 것 같네요.', '「 #스트라이프 패턴 니트 」', '「 #스트라이프 패턴 니트 」', '', '', '', '1년 내내 입어도 질리지 않는 스트라이프 풀오버!시각적인 재미가 있어 스웨터 하나로 충분한 포인트가 될 수 있어요. 같은 스트라이프 패턴이지만 다른 분위기를 드러낸 두 명의 스타를 만나볼까요? 구멍 난 볼드한 블랙 스트라이프 패턴 스웨터로 그런지 무드를 살린 지수는 디올의 로고가 새겨진 자카르 백으로 패턴 플레이를 즐겼습니다. 형형색색의 스트라이프 패턴이 경쾌한 크롭트 풀오버에 마이크로 백을 메고 상큼한 인상을 풍기는 이시영. 컬러플한 스트라이프 패턴을 선택한 덕분에 틴에이저같이 생기 넘치는 스타일이 완성됐어요.', '「 #집업 니트 」', '「 #집업 니트 」', '', '', '', '이번 시즌 새롭게 등장한 니트 디자인이 있습니다. 바로 집업 스웨터인데요, 트렌드에 민감한 스타들의 룩에서 찾아볼 수 있어요. 네크라인의 지퍼를 모두 내려 넓은 칼라처럼 활용한 태연의 룩은 이번 시즌 유행하는 80년대 무드를 떠올립니다. 어깨를 강조한 디자인이 얼굴을 작아 보이도록 해 어깨가 좁은 체형에강력히 추천하는 스타일이에요. 효민은 소매에 주름을 잡아 볼륨감을 더한 집업 스웨터에 하의와 슈즈를 톤온톤으로 매치해 모던한 분위기로 소화했습니다. 스포티한 디자인이지만 우아하게 스타일링한 것이 포인트! 니트웨어로 ‘인싸’되고 싶다면 집업 니트를 지금 바로 ‘겟’하세요.'], ['', '', '', '', '', '', '', '']]|FASHION|1|0|Je|E|"[""[['「 #케이블 니트 」', '「 #케이블 니트 」', '', '', '', '입체적인 꼬임 패턴이 매력적인 케이블 니트는 클래식 중 클래식. 유행 없이 입을 수 있어 옷장 속에 마련해두면 오래도록 입을 수 있는 아이템이죠. 단순한 꽈배기 무늬부터 다양한 꼬임을 믹스한 디자인까지 다양한데요, 어떤 디자인을 선택하느냐에 따라 그날의 분위기를 좌우할 수 있어요. 잔잔한 케이블 패턴의 핑크색 카디건에 넉넉한 데님 팬츠를 매치해 90년대 뉴트로 룩을 완성한 황승언과 부위별로 다채로운 패턴이 리드미컬하게 배열된 케이블 스웨터에 블랙 팬츠와 선글라스로 시크함을 강조한 공효진. 모두 케이블 니트를 선택했지만, 확실히 달라 보이죠?', '「 #오버사이즈 니트 」', '「 #오버사이즈 니트 」', '', '', '', '니트가 주는 포근한 분위기를 만끽하고 싶다면 오버사이즈 니트가 제격입니다. 윤승아는 큼지막한 멜란지 그레이 컬러의 스웨터에 블랙 레깅스로 웨어러블한 스타일을 즐겼는데요, 여기에 컬러플한 크로스보디 백을 더해 귀엽게 마무리했어요. 주말 집 앞 산책 룩으로도 좋을 것 같네요. 제니는 레터링 장식의 블랙 터틀넥 스웨터를 미니 원피스처럼 연출하고 사이 파이 선글라스를 더해 쿨하게 즐겼습니다. 슈즈로사이 하이 부츠를 선택한다면 트렌디하게 연출할 수 있을 것 같네요.', '「 #스트라이프 패턴 니트 」', '「 #스트라이프 패턴 니트 」', '', '', '', '1년 내내 입어도 질리지 않는 스트라이프 풀오버!시각적인 재미가 있어 스웨터 하나로 충분한 포인트가 될 수 있어요. 같은 스트라이프 패턴이지만 다른 분위기를 드러낸 두 명의 스타를 만나볼까요? 구멍 난 볼드한 블랙 스트라이프 패턴 스웨터로 그런지 무드를 살린 지수는 디올의 로고가 새겨진 자카르 백으로 패턴 플레이를 즐겼습니다. 형형색색의 스트라이프 패턴이 경쾌한 크롭트 풀오버에 마이크로 백을 메고 상큼한 인상을 풍기는 이시영. 컬러플한 스트라이프 패턴을 선택한 덕분에 틴에이저같이 생기 넘치는 스타일이 완성됐어요.', '「 #집업 니트 」', '「 #집업 니트 」', '', '', '', '이번 시즌 새롭게 등장한 니트 디자인이 있습니다. 바로 집업 스웨터인데요, 트렌드에 민감한 스타들의 룩에서 찾아볼 수 있어요. 네크라인의 지퍼를 모두 내려 넓은 칼라처럼 활용한 태연의 룩은 이번 시즌 유행하는 80년대 무드를 떠올립니다. 어깨를 강조한 디자인이 얼굴을 작아 보이도록 해 어깨가 좁은 체형에강력히 추천하는 스타일이에요. 효민은 소매에 주름을 잡아 볼륨감을 더한 집업 스웨터에 하의와 슈즈를 톤온톤으로 매치해 모던한 분위기로 소화했습니다. 스포티한 디자인이지만 우아하게 스타일링한 것이 포인트! 니트웨어로 ‘인싸’되고 싶다면 집업 니트를 지금 바로 ‘겟’하세요.'], ['', '', '', '', '', '', '', '']]""]"
'핑크색 입으면 기분이 조크든요' 핑크 홀릭|http://v.media.daum.net/v/20201117115642590|2020.11.17|http://v.media.daum.net/v/20201117115642590?f=o|[['', '', '', '', '', '', '', '', '', '', '', '', '', '', '', ''], ['', '제니는 핑크와 화이트 스트라이프 패턴의 카디건과 쇼츠를 입었어요. 핑크와 화이트로 꾸며진 ‘소녀소녀’한 공간을 배경으로 바비 인형을 떠올리는 사랑스러운 룩을 입은 제니가 포토제닉한 순간을 연출합니다. 그저 사랑스러운 모습에 그치지 않고 허리에서 허벅지까지 체인 주얼리를 늘어뜨려 팝스타의 포스를 더한 그녀의 센스를 눈여겨보세요.', '', '제시는 여러 톤의 핑크색을 그녀의 방식대로 쿨하게 소화했습니다. 화이트 보디 수트에 은은한 광택이 도는 숏패딩 점퍼를 오프 숄더 톱처럼 팔에 살짝 걸쳐 입고 치골까지 트레이닝 팬츠를 내려 입은 과감한 패션을 선보였죠. 여기에 베이비 핑크색 샤넬 백을 믹스매치해 개성 있는 데일리 룩을 완성했습니다.', '', '한예슬의 푸시아 핑크 톱에 시선 집중! 존재감 넘치는 스웨터에 시선이 집중될 수 있도록 미니스커트와 앵클 부츠, 크로스 보디 백을 모두 블랙으로 맞춰주었어요. 이렇게 컬러감 강한 핑크를 선택했다면 다른 아이템들을 무채색으로 선택해보세요. 세련된 느낌은 물론, 간단하면서도 확실한 포인트를 줄 수 있을 거예요.', '', '귀여운 느낌을 선사하는 파스텔 톤의 핑크 컬러도 킴 카다시안을 만나면 관능적인 분위기로 변신합니다. 대담한 커팅의 보디 컨셔스 톱과 미니스커트로 글래머러스한 보디 라인을 강조한 그녀. 함께 신은 투명 PVC 슈즈와 조형적인 핑크색 귀걸이로 온전히 핑크색에 집중한 그녀의 룩을 살펴보세요.', '추천! 데일리 핑크템', '데일리 룩에 활력을 실어줄 핑크 컬러 아이템을 골라봤어요.', '', '', '', '', '', '', '', '']]|FASHION|0|0|Je|E|['제니는 핑크와 화이트 스트라이프 패턴의 카디건과 쇼츠를 입었어요. 핑크와 화이트로 꾸며진 ‘소녀소녀’한 공간을 배경으로 바비 인형을 떠올리는 사랑스러운 룩을 입은 제니가 포토제닉한 순간을 연출합니다. 그저 사랑스러운 모습에 그치지 않고 허리에서 허벅지까지 체인 주얼리를 늘어뜨려 팝스타의 포스를 더한 그녀의 센스를 눈여겨보세요.']
제니부터 조이까지! 스타들이 선택한 #리본헤어스타일|http://v.media.daum.net/v/20201112070037606|2020.11.12|http://v.media.daum.net/v/20201112070037606?f=o|[['「 포니테일 스타일에 생기있게 」', '「 포니테일 스타일에 생기있게 」', '', '', '', '', '', '', '', '포니테일 헤어스타일에 잘 고른 리본 헤어 액세서리 하나 더하면 발랄함을 실어줄 수 있어요. 리본의 모양과 크기에 따라서 서로 다른 분위기가 연출되는데, 포니테일을 한 셀러브리티의 리본 활용법을 함께 살펴볼까요?', '「 반 묶음 스타일에 간편하게 」', '「 반 묶음 스타일에 간편하게 」', '', '', '', '', '', '', '', '차분하고 아름다운 분위기를 연출하는 반 묶음 헤어에도 리본을 활용해보세요. 여자친구 신비는 자연스러운 컬이 돋보이는 중 단발 헤어를 반만 묶고 크롭트 블라우스와 같은 하얀색 리본으로 앙증맞게 장식했고, 패션 인플루언서 마리안느 도더슨은 얼굴 크기만큼 큰 하늘색 새틴 리본으로 뒷모습에 승부를 걸었습니다. 헤어 액세서리의 존재감만으로 소녀 감성 뿜뿜!', '「 양 갈래 스타일을 더 귀엽게 」', '「 양 갈래 스타일을 더 귀엽게 」', '', '', '', '', '', '', '', '귀엽고 깜찍한 분위기를 연출하고 싶다면 양 갈래 헤어에 리본을 활용해보세요. 조이는 헤어의 반을 정확하게 나눈 뒤 양쪽으로 헤어를 동그랗게 말아올 린 후 블랙 새틴 리본으로 마무리했어요. 레이스 블라우스와 새틴 리본의 조화에서 복고적인 무드가 느껴집니다.'], ['', '', '', '', '러블리즈 유지애는 레오퍼드 무늬의 깜찍한 리본으로 데일리 룩에 포인트를 주었어요. 뒷머리는 포니테일로 올려 묶고 앞머리와 귀 옆의 잔머리에 굵은 컬을 주어 귀여운 터치를 더 했죠.', '혜리는 굵게 웨이브를 더한 포니테일 헤어에 큰 사이즈의 새틴 리본을 더했어요. 레이스 블라우스와 프릴 장식 미니스커트, 홀스빗 로퍼로 완성한 사랑스러운 스쿨걸 룩에 잘 어울리는 선택인 듯하네요.', '제니는 포니테일 스타일에 리본을 댕기처럼 길게 늘어뜨렸어요. 그녀 스타일을 따라 해보고 싶다면 포니테일이 잘 고정되도록 머리끈으로 먼저 헤어를 단단하게 묶은 뒤 그 위를 넓은 리본으로 감싸 늘어뜨려주세요. 헤어 길이와 비슷하게 리본을 남겨주는 것이 포인트!', '', '', '', '', '이유비는 라벤더 컬러의 커다란 리본 장식 헤어핀을 정수리에 꽂아 러블리하게 연출했어요. 시스루 뱅 스타일의 앞머리와 느슨한 웨이브 헤어가 귀여운 매력을 극대화하고 있어요. 리본 컬러가 고민된다면 그녀처럼 상의의 컬러와 비슷하게 선택해보세요.', '', '', '', '', '러블리즈 류수정은 폭이 넓은 리본을 어깨까지 길게 늘어뜨려 드라마틱한 포인트를 주었습니다. 선명한 레드 헤어와 대조되는 리본 컬러 선택이 신비로운 느낌을 강조하고 있죠.', '위키미키 세리는 양 갈래로 나눈 반 묶음 헤어 스타일에 입체적인 노란색 리본을 달아 상큼하게 마무리했어요. 헤어 안쪽에만 진한 핑크색 블리치를 넣고 노란 리본까지 더하니, 마치 애니메이션 속 주인공처럼 귀여운 그만의 스타일이 완성됐네요.']]|STAR|1|0|Je|E|"[""[['「 포니테일 스타일에 생기있게 」', '「 포니테일 스타일에 생기있게 」', '', '', '', '', '', '', '', '포니테일 헤어스타일에 잘 고른 리본 헤어 액세서리 하나 더하면 발랄함을 실어줄 수 있어요. 리본의 모양과 크기에 따라서 서로 다른 분위기가 연출되는데, 포니테일을 한 셀러브리티의 리본 활용법을 함께 살펴볼까요?', '「 반 묶음 스타일에 간편하게 」', '「 반 묶음 스타일에 간편하게 」', '', '', '', '', '', '', '', '차분하고 아름다운 분위기를 연출하는 반 묶음 헤어에도 리본을 활용해보세요. 여자친구 신비는 자연스러운 컬이 돋보이는 중 단발 헤어를 반만 묶고 크롭트 블라우스와 같은 하얀색 리본으로 앙증맞게 장식했고, 패션 인플루언서 마리안느 도더슨은 얼굴 크기만큼 큰 하늘색 새틴 리본으로 뒷모습에 승부를 걸었습니다. 헤어 액세서리의 존재감만으로 소녀 감성 뿜뿜!', '「 양 갈래 스타일을 더 귀엽게 」', '「 양 갈래 스타일을 더 귀엽게 」', '', '', '', '', '', '', '', '귀엽고 깜찍한 분위기를 연출하고 싶다면 양 갈래 헤어에 리본을 활용해보세요. 조이는 헤어의 반을 정확하게 나눈 뒤 양쪽으로 헤어를 동그랗게 말아올 린 후 블랙 새틴 리본으로 마무리했어요. 레이스 블라우스와 새틴 리본의 조화에서 복고적인 무드가 느껴집니다.'], ['', '', '', '', '러블리즈 유지애는 레오퍼드 무늬의 깜찍한 리본으로 데일리 룩에 포인트를 주었어요. 뒷머리는 포니테일로 올려 묶고 앞머리와 귀 옆의 잔머리에 굵은 컬을 주어 귀여운 터치를 더 했죠.', '혜리는 굵게 웨이브를 더한 포니테일 헤어에 큰 사이즈의 새틴 리본을 더했어요. 레이스 블라우스와 프릴 장식 미니스커트, 홀스빗 로퍼로 완성한 사랑스러운 스쿨걸 룩에 잘 어울리는 선택인 듯하네요.', '제니는 포니테일 스타일에 리본을 댕기처럼 길게 늘어뜨렸어요. 그녀 스타일을 따라 해보고 싶다면 포니테일이 잘 고정되도록 머리끈으로 먼저 헤어를 단단하게 묶은 뒤 그 위를 넓은 리본으로 감싸 늘어뜨려주세요. 헤어 길이와 비슷하게 리본을 남겨주는 것이 포인트!', '', '', '', '', '이유비는 라벤더 컬러의 커다란 리본 장식 헤어핀을 정수리에 꽂아 러블리하게 연출했어요. 시스루 뱅 스타일의 앞머리와 느슨한 웨이브 헤어가 귀여운 매력을 극대화하고 있어요. 리본 컬러가 고민된다면 그녀처럼 상의의 컬러와 비슷하게 선택해보세요.', '', '', '', '', '러블리즈 류수정은 폭이 넓은 리본을 어깨까지 길게 늘어뜨려 드라마틱한 포인트를 주었습니다. 선명한 레드 헤어와 대조되는 리본 컬러 선택이 신비로운 느낌을 강조하고 있죠.', '위키미키 세리는 양 갈래로 나눈 반 묶음 헤어 스타일에 입체적인 노란색 리본을 달아 상큼하게 마무리했어요. 헤어 안쪽에만 진한 핑크색 블리치를 넣고 노란 리본까지 더하니, 마치 애니메이션 속 주인공처럼 귀여운 그만의 스타일이 완성됐네요.']]""]"
저장각! 겨울 필수템 머플러, 스타들의 연출법과 추천템 리스트|http://v.media.daum.net/v/20201111070112614|2020.11.11|http://v.media.daum.net/v/20201111070112614?f=o|[['「 #1 장희령 」', '「 #1 장희령 」', '환한 미소만큼이나 상큼상큼! 딥 브라운 재킷 위에 오렌지와 그린 컬러가 믹스된 유어네임히얼 머플러로 포인트를 준 장희령. F/W 시즌 어두운 아우터를 주로 입게 된다면 컬러풀한 머플러를 주목하세요. 안색까지 환해지는 머플러를 둘러주면 스타일리시한 무드가 더해질 테니까요.', '「 #2 서은수 」', '「 #2 서은수 」', '클래식한 디자인의 헤링본 코트를 선택한 서은수. 블랙 베레와 네이비 머플러로 마무리해 사랑스러우면서도 차분한 데일리 룩을 완성했어요. 그레이와 네이비는 실패 확률이 적은 쿨 톤 컬러 조합이랍니다. 여기에 힌트를 얻어 네이비 외투에 그레이 컬러 머플러 조합도 시도해보세요.', '「 #3 차정원 」', '「 #3 차정원 」', '아이보리와 베이지 투 톤 조합의 머플러를 카멜 코트에 매치해 찰떡같은 스타일링을 보여준 차정원. 머플러를 반으로 접어 목에 두른 후 만들어진 고리 사이로 머플러 끝부분을 넣어주는 랩 어라운드 스타일로 연출했어요. 덕분에 더 클래식한 분위기가 살아났죠?', '「 #4 제니 」', '「 #4 제니 」', '머플러 컬러를 선택할 때 옷 말고 액세서리와의 궁합을 고려하는 것도 좋은 방법입니다. 제니의 룩이 바로 그 예시죠. 네이비 톤의 니트와 블랙 데님으로 완성한 심플 데일리 룩에 브라운 컬러의 로에베 토트백을 선택했어요. 여기에 브라운 톤의 체크 패턴 머플러를 더해 룩의 통일감을 높여줬어요.', '「 #5 조우리 」', '「 #5 조우리 」', '', '', '', '', '', '추억을 되살리며 지난 여행 사진을 업로드한조우리. 스타일리시한 여행지 패션에서 눈길을 사로잡는 아이템 역시 머플러예요. 아우터 컬러와 잘 어울리는 니트 머플러부터 체크 재킷에 매치한 딥 그레이 컬러의 머플러, 블랙 탑에 확실한 포인트가 되어주는 브릭 컬러의 헤링본 머플러까지! 머플러의 또렷한 존재감이 빛을 발하는 3가지 데일리 룩, 슬라이드를 넘겨 감상해보세요!', '「 #6 크리스탈 」', '「 #6 크리스탈 」', '올리브그린 컬러의 푸퍼로 데일리 룩을 완성한 크리스탈. 푸퍼 컬러와 잘 어울리는 겨울 액세서리를 더해 더없이 포근한 데일리 룩을 완성했어요. 시어링 소재의 아이보리 비니와 베이지 머플러를 매치해준 거죠. 크리스탈처럼 머플러, 비니, 혹은 장갑 등 겨울 액세서리의 소재와 컬러에 주의를 기울여 선택한다면 좀 더 스타일리시한 데일리 룩을 완성할 수 있답니다.', '「 #7 강민경 」', '「 #7 강민경 」', '세련된 컬러 플레이가 돋보이는 강민경의 데일리 룩! 룩의 화룡점정은 딥 블루 컬러의 아비에무아 머플러랍니다. 체크 재킷에 믹스된 브라운과 블루 컬러에서 영감을 얻어 데일리 룩을 완성한 것처럼 모든 아이템의 컬러가 잘 어우러지네요. 카멜 톤의 에르메스 백과 카키 컬러 와이드 팬츠, 그리고 머플러와 찰떡궁합을 이루는 베이비 블루 컬러의 니트까지. 따라 하고 싶은 머플러 스타일링이죠?', '「 #머플러 쇼핑 리스트 7 」', '「 #머플러 쇼핑 리스트 7 」', '', '', '', '', '', '', '', '', '', '', '', '', ''], ['', '', '', '', '', '', '', '', '', '', '', '', '', '', '', '', '']]|FASHION|0|0|Je|E|['「 #4 제니 」', '「 #4 제니 」', '머플러 컬러를 선택할 때 옷 말고 액세서리와의 궁합을 고려하는 것도 좋은 방법입니다. 제니의 룩이 바로 그 예시죠. 네이비 톤의 니트와 블랙 데님으로 완성한 심플 데일리 룩에 브라운 컬러의 로에베 토트백을 선택했어요. 여기에 브라운 톤의 체크 패턴 머플러를 더해 룩의 통일감을 높여줬어요.']
스타일 좋은 여자들이 고르는 연청! 데님으로 '쿨내'풍기기|http://v.media.daum.net/v/20201103082730322|2020.11.03|http://v.media.daum.net/v/20201103082730322?f=o|[[], ['', '레드 벨벳 슬기는 자연스러운 워싱이 돋보이는 데님 팬츠를 입었어요. 오버사이즈 재킷과 매치해 꾸민 듯 안 꾸민 듯 멋스러운 룩을 연출했어요. 여유로운 실루엣과 라이트 블루 톤의 조화로운 컬러가 돋보이는 듯합니다.', '', '제니는 섹시한 미니 드레스 위에 라이트한 컬러의 크롭트 데님 재킷을 레이어드했어요. 여기에 스크런치로 머리를 높게 묶고 동그란 선글라스를 매치해 80년대 스타일을 현대적으로 해석한 패션 센스를 뽐내고 있어요.', '', '김나영의 데일리 룩을 보세요. 포멀한 트위드 재킷에 밝은 색의 데님 셔츠와 스커트를 믹스매치해 색다른 분위기를 연출했죠. 클래식한 아이템의 인상을 단번에 친근하게 바꾸는 데님의 매력이 느껴지시나요?', '', '모델 발레리아 리포베츠키는 웨스턴 스타일의 데님 셔츠 원피스를 선택했어요. 벨트로 허리 라인을 강조해 셔츠 드레스의 단점을 커버했죠. 파이톤 패턴의 뮬과 미니멀한 차콜 컬러 쇼퍼백으로 ‘찐’ 아메리칸 스타일을 표현한 그녀의 데일리 룩이 근사합니다.', '', '데님 소재라고 언제나 캐주얼하기만 한 것은 아닙니다. 패션 인플루언서 빅토리아 레이더의 패션에서 힌트를 얻을 수 있어요. 그녀는 밝은 색으로 워싱 된 데님 소재의 점프 수트를 선택했는데, 자칫 워크 웨어처럼 투박한 느낌이 들 수 있는 데님 점프 수트에 은은한 광택이 도는 화이트 트렌치코트를 더해 스타일리시하게 마무리했죠. 고정관념을 깬 데님 스타일에 도전하고 싶다면 테일러링을 기억하세요!']]|FASHION|0|0|Je|E|['제니는 섹시한 미니 드레스 위에 라이트한 컬러의 크롭트 데님 재킷을 레이어드했어요. 여기에 스크런치로 머리를 높게 묶고 동그란 선글라스를 매치해 80년대 스타일을 현대적으로 해석한 패션 센스를 뽐내고 있어요.']
